Date,Name,Roll No,Room No,Contact,Equipment,Time,Remarks
1989-04-13,James Vazquez,2020698,A-98,7898042665,apply,16:30,Threat security glass artist apply wait character day.
1996-01-26,Sara Acosta,2018912,A-778,3302909570,store,16:37,Treat though eye.
2019-11-27,Dr. Angela Johnson MD,2021304,A-708,8864689188,think,12:06,Must church form seat.
2011-05-02,John Sanchez,2021063,A-813,9893841924,none,06:06,Thus guy cover.
2001-05-10,Daniel Ortega,2019445,A-603,4266867225,ahead,04:37,Believe it writer project entire and protect.
1984-02-06,Amy Mills,2024318,A-520,7155587669,sure,19:38,Significant name keep stage suggest hour public.
1983-04-22,Vincent Watson,2020964,A-586,1769498734,paper,10:53,Garden probably most fear fund though sort.
1974-06-25,Christina Larson,2021533,A-977,7802264461,prepare,03:33,Strong the within anyone feel.
1975-08-03,Robert Castillo,2020952,A-171,4018882541,fund,19:52,Than bag possible visit political country.
2006-05-15,Anthony Watts,2021711,A-557,5679895297,leave,16:15,Drug Mr state writer song great.
2021-03-13,Paige Miller,2024013,A-661,842822343,because,10:20,Question hospital include rock.
2022-01-06,Candice Stuart,2020977,A-970,5356256791,meeting,14:22,Building newspaper however Republican yeah exist kitchen.
1987-09-01,Lee Sims,2018273,A-716,7741534601,building,02:32,Effort music forward set.
2008-07-05,Amanda Farrell,2022454,A-258,6733337624,forward,06:00,Hotel activity present environmental remain.
1972-07-13,Trevor Thomas,2022971,A-671,8036911014,cell,15:52,Face test at response store concern wide itself.
1987-03-07,Amy Mills,2024318,A-4,7155587669,remember,06:58,Pay rest last note.
1972-07-12,Alexander Cooke,2019078,A-296,790449823,across,15:43,Environment serve arrive information shake add design.
2014-06-11,Shawn Trujillo,2022952,A-646,5983479608,attack,23:38,Security standard hear third increase must understand.
2020-02-08,Louis Benitez,2023050,A-82,961559272,leg,08:28,As prevent up consider reality wrong give.
1983-10-22,Katherine Woods,2020199,A-630,7064142123,describe,19:27,Particularly color human floor say.
1994-02-28,James Vazquez,2020698,A-949,7898042665,prevent,13:43,Also provide feel store.
1994-09-26,Vincent Watson,2020964,A-218,1769498734,single,18:42,Result heart whether film though.
1987-10-21,John Sanchez,2022945,A-24,960192465,kitchen,13:51,Painting better interview decade health show.
2013-09-04,Patrick Hill,2024269,A-737,1573624239,much,22:44,Recently natural development senior important.
1991-12-20,Sherri Reynolds,2023335,A-286,8817250187,lose,09:21,Audience exactly could.
1982-11-25,Jesse James,2020014,A-965,8197367135,weight,10:53,Table shake because letter.
2020-02-25,Michael Vaughn,2019523,A-668,725713463,in,03:20,Stage authority direction common discover.
2007-06-16,Vincent Watson,2020964,A-894,1769498734,enough,11:24,Service foot provide dark yes.
2012-09-08,Eric Singh,2018962,A-163,2027067850,fall,09:39,Simply its prove hard wrong beat.
1998-11-23,Katie Jones MD,2021958,A-351,96649952,now,00:11,Will trade question program property region wonder turn.
2023-03-21,Sherry Blankenship,2020273,A-357,9888629190,sea,17:41,Difference become song provide cause down believe wife.
2007-09-30,Andrea Peterson,2024037,A-714,5919891729,suffer,11:25,Scientist rather participant explain recent tough out.
1996-12-26,Keith Mitchell,2023311,A-707,7941668218,course,15:43,All ok suggest radio.
1989-05-26,Terrence Bell,2019544,A-912,8389283233,sound,22:00,Participant station card.
1980-10-19,Brett Kramer,2024472,A-832,1729343811,difference,14:02,History word practice size.
2003-07-11,Kenneth Braun,2022451,A-643,970650112,always,10:01,Marriage whom responsibility position hold avoid price.
2023-01-12,James Vazquez,2020698,A-883,7898042665,detail,19:14,She ground beat road together.
2020-06-24,Ashley Smith,2019298,A-677,5978474850,other,21:25,First drive among thought including.
1977-12-04,John Anderson,2024568,A-758,6733487269,us,01:46,Later stay perform staff both data.
2006-07-16,Beverly Patterson,2021505,A-891,1526645922,wrong,18:06,While travel window always.
1989-02-20,Kelly Mcdonald,2018951,A-887,1499306052,hospital,17:46,Pull own interesting trial major factor style.
2016-05-16,Kristina Weaver,2022969,A-948,222064473,daughter,15:56,Institution hot detail.
1983-01-20,Louis Benitez,2023050,A-759,961559272,five,10:42,Item federal deep employee.
1976-01-24,Jessica Phelps,2020312,A-861,7889963851,why,00:19,Life turn deal eight hotel firm manage.
1997-09-16,Anthony Watts,2021711,A-538,5679895297,she,03:51,Little not hit investment direction time politics.
1986-10-12,Robert Castillo,2020952,A-24,4018882541,news,11:10,Itself tough various improve may.
1987-08-08,Beverly Patterson,2021505,A-422,1526645922,then,04:29,Stand goal future once feel.
2005-10-24,Michael Rivera,2021051,A-650,3812686285,anything,19:16,Public I may past difficult no born.
1995-06-06,Beverly Patterson,2021505,A-248,1526645922,bed,15:18,Drop hundred be site.
1984-06-10,John Oliver,2019508,A-769,9171562188,impact,16:00,Guess sure by most baby line.
1994-02-12,Melvin Gutierrez,2020781,A-813,6838045738,discover,02:58,Often get look.
2016-08-30,Amy Mills,2024318,A-98,7155587669,board,16:41,Tough agency would against.
2015-12-02,Anthony Watts,2021711,A-71,5679895297,very,00:51,Eat behind feel letter experience.
1973-06-17,Kristina Weaver,2022969,A-322,222064473,option,15:50,Something purpose fund grow executive claim unit.
1972-09-15,Katie Jones MD,2021958,A-206,96649952,market,00:44,Story produce strong ahead hold suffer before.
1985-01-22,Vincent Watson,2020964,A-306,1769498734,knowledge,06:38,Drive see cold event past material left.
1970-05-26,Brittany Mcneil,2020565,A-885,1018042251,people,19:37,Peace return movement.
1970-06-10,Sophia Wade,2018233,A-243,5774533670,ahead,03:26,Blue try dog need.
2003-10-02,Andrea Peterson,2024037,A-557,5919891729,race,16:05,Single myself mouth stage toward.
2002-02-27,Lee Sims,2018273,A-133,7741534601,above,10:13,Student sit move decade pick.
1988-08-15,Daniel Ortega,2019445,A-110,4266867225,capital,12:26,Imagine station these since court drug.
2009-03-02,Stacey Richardson,2021315,A-591,8364545279,artist,04:12,Idea worry know everybody.
1976-01-30,Tracy Larsen,2018070,A-134,8544747720,save,01:51,Left weight other he visit public popular.
1997-06-07,Brittany Mcneil,2020565,A-605,1018042251,worry,18:04,Edge late medical national effect miss reveal listen.
2014-07-06,Sophia Wade,2018233,A-739,5774533670,new,17:28,Main nearly Mrs minute fall main budget.
1972-08-21,Anthony Watts,2021711,A-914,5679895297,election,11:07,Your current maybe argue.
1974-08-07,Candice Stuart,2020977,A-709,5356256791,picture,06:55,Option raise gun phone only section.
2022-11-20,Louis Benitez,2023050,A-685,961559272,like,03:44,Base hair section hope economic collection.
1989-12-30,Sarah Harris,2020818,A-788,3808586863,official,14:48,Animal live after easy music.
2022-12-29,Kathy Graham,2020542,A-132,240813300,for,03:54,Eye change share of.
2002-05-02,Michael Vaughn,2019523,A-75,725713463,bad,05:04,Usually card on region.
2005-03-20,Ashley Smith,2019298,A-118,5978474850,Democrat,02:17,Finally present experience feeling.
1990-12-21,Jonathan Stevens,2018517,A-139,3478602357,race,09:05,Expect commercial science produce store.
2010-11-20,John Sanchez,2022945,A-621,960192465,throughout,09:44,Can number him.
2019-12-21,John Anderson,2024568,A-755,6733487269,public,02:28,Receive design term detail old.
1973-02-21,Shari Sullivan,2020255,A-429,9250000391,city,10:13,Good already choose gas.
2022-06-11,Robert Castillo,2020952,A-574,4018882541,PM,01:09,Character assume wind community right tell population subject.
1997-09-06,Shawn Trujillo,2022952,A-330,5983479608,action,20:32,Professional hand book simply degree practice together.
1973-03-04,Lauren Bennett,2020713,A-533,4262543973,community,13:43,Bar word however bar wide will perhaps.
2017-05-09,Sandra Pena,2019912,A-189,201305639,shoulder,03:48,Against address wife thus.
1974-07-28,Kevin Hansen,2022005,A-469,8856618190,court,10:43,Language book your individual town child find.
1990-02-13,Mary Wilson,2018132,A-316,5417418119,country,04:10,Trade investment employee service.
1986-03-13,David Rodriguez,2021627,A-415,4553314348,sell,09:12,Kind real want our line.
1978-01-22,Daniel Ortega,2019445,A-915,4266867225,care,18:25,Red might health.
2001-07-07,Jonathan Stevens,2018517,A-913,3478602357,face,07:37,Month attack watch.
2002-11-29,Sarah Gill,2022287,A-309,1613921420,seem,06:20,Bad wish possible beautiful.
1970-02-04,Louis Benitez,2023050,A-461,961559272,director,22:30,Car program radio worry.
2017-12-08,Sophia Wade,2018233,A-414,5774533670,commercial,05:25,Continue remember clear fund again high media.
1997-07-31,Robert Miller,2020515,A-865,917872027,get,15:55,Democratic receive heavy development different.
2016-03-23,Terrence Bell,2019544,A-461,8389283233,hotel,05:44,That capital couple hotel strong ahead.
2000-01-29,Elizabeth Shea,2023862,A-142,4112929085,some,22:20,Bill since within down.
1972-07-13,David Rodriguez,2021627,A-203,4553314348,happen,09:18,Information deep less manager you foot.
1992-07-12,Robert Castillo,2020952,A-985,4018882541,leave,11:15,Move we according quite scene wear group.
2000-03-08,Trevor Thomas,2022971,A-666,8036911014,dark,07:42,Popular eye candidate suggest sea.
1995-06-02,Katherine Woods,2020199,A-452,7064142123,answer,05:54,Feeling tell receive across grow.
1975-09-01,Brett Kramer,2024472,A-207,1729343811,daughter,00:17,Official usually education sense section.
1976-06-16,Katrina Munoz,2021136,A-89,9322088462,hear,00:02,Trial increase home.
2011-07-26,Eric Singh,2018962,A-629,2027067850,good,04:24,Poor compare maintain on of.
2014-10-18,Ashley Smith,2019298,A-993,5978474850,couple,06:58,Method contain return politics play.
2005-09-29,Louis Benitez,2023050,A-467,961559272,figure,02:53,Blue science on easy.
