Date,Name,Roll No,Room No,Contact,Equipment,Time,Remarks,Unique_Key,Key_Combination,LookUp_Count,Update_Count
1971-01-27,Seth Morrison,2020520,A-809,2868727992,time,17:59,Provide different beautiful.,2020520_17:59_1971-01-27,Roll_No:Time:Date,0,0
2020-09-12,Brian Lynn,2020058,A-487,9208629035,nice,21:22,Or large three because.,2020058_21:22_2020-09-12,Roll_No:Time:Date,0,0
1988-01-01,Diane Anderson,2019957,A-572,3958205279,able,01:11,Whether amount enough school shoulder.,2019957_01:11_1988-01-01,Roll_No:Time:Date,0,0
1985-03-06,Bryan Robinson,2022356,A-16,5926021109,inside,12:12,Southern write player national modern bank.,2022356_12:12_1985-03-06,Roll_No:Time:Date,0,0
1970-05-07,Christina Cook,2020972,A-738,5669666642,return,12:55,Those blue friend method.,2020972_12:55_1970-05-07,Roll_No:Time:Date,0,0
2013-12-25,Mike Moreno,2021268,A-13,1780789157,follow,19:05,Generation about yard task note bring I.,2021268_19:05_2013-12-25,Roll_No:Time:Date,0,0
1994-05-02,Kristen Guerrero,2024461,A-450,4901625889,test,18:18,Note husband dream yourself that behavior offer.,2024461_18:18_1994-05-02,Roll_No:Time:Date,0,0
1979-04-05,Christina Cook,2020972,A-928,5669666642,kind,09:03,Citizen official say energy understand development road.,2020972_09:03_1979-04-05,Roll_No:Time:Date,0,0
1976-11-01,Brian Lynn,2020058,A-534,9208629035,west,16:15,Than clear summer truth rule this.,2020058_16:15_1976-11-01,Roll_No:Time:Date,0,0
1981-03-30,Edwin Lee,2020258,A-102,8285388371,keep,01:16,Dog into air.,2020258_01:16_1981-03-30,Roll_No:Time:Date,0,0
1972-06-30,Richard Aguilar,2022139,A-937,1747617865,soldier,23:44,Book herself while into writer hold new.,2022139_23:44_1972-06-30,Roll_No:Time:Date,0,0
1998-07-19,Julia Odonnell MD,2022564,A-547,615656117,member,01:21,Since owner film career social old.,2022564_01:21_1998-07-19,Roll_No:Time:Date,0,0
1984-04-13,Jason Anderson,2022774,A-192,7433665578,cultural,13:04,Next officer join cultural paper everyone everyone must.,2022774_13:04_1984-04-13,Roll_No:Time:Date,0,0
1976-04-06,Tara Patterson,2022083,A-294,5452040850,age,08:34,Argue approach decade list baby decision store.,2022083_08:34_1976-04-06,Roll_No:Time:Date,0,0
1979-07-15,Janice Salinas,2018558,A-959,1479637646,step,08:32,Soon wide field open control every trouble.,2018558_08:32_1979-07-15,Roll_No:Time:Date,0,0
1984-08-29,Allen Rogers,2022383,A-689,6117019160,hotel,18:25,Develop leader bag teach somebody.,2022383_18:25_1984-08-29,Roll_No:Time:Date,0,0
1985-02-18,Wesley Howard,2024866,A-796,3399567270,dark,18:28,Newspaper interest push mention enough field.,2024866_18:28_1985-02-18,Roll_No:Time:Date,0,0
2000-09-11,Seth Morrison,2020520,A-580,2868727992,officer,16:14,School attack act short.,2020520_16:14_2000-09-11,Roll_No:Time:Date,0,0
2016-02-20,Samantha Schmidt,2018794,A-451,2154346783,determine,19:01,Near television save.,2018794_19:01_2016-02-20,Roll_No:Time:Date,0,0
2000-10-18,Robert Powell,2018986,A-595,3177268454,stand,04:34,Various artist no light onto reason prove already.,2018986_04:34_2000-10-18,Roll_No:Time:Date,0,0
2011-09-03,Louis Johnson,2024204,A-306,7574721908,visit,14:31,Story month wide.,2024204_14:31_2011-09-03,Roll_No:Time:Date,0,0
1994-12-31,Cody Valencia,2019061,A-786,8225881589,say,10:54,Us others senior young.,2019061_10:54_1994-12-31,Roll_No:Time:Date,0,0
2007-10-14,Stephanie Turner,2018311,A-497,1271978401,dream,11:49,Campaign edge amount bill sign policy check.,2018311_11:49_2007-10-14,Roll_No:Time:Date,0,0
1971-05-01,Elizabeth Hammond,2022025,A-550,5464112426,accept,17:01,Probably member kind audience word away nearly.,2022025_17:01_1971-05-01,Roll_No:Time:Date,0,0
1990-08-21,David Cooper,2018858,A-865,1127896198,PM,01:35,Than rock oil music body opportunity hand person.,2018858_01:35_1990-08-21,Roll_No:Time:Date,0,0
1971-03-07,Kimberly Alexander,2019106,A-250,3383297758,hotel,00:00,Part research record work modern serve.,2019106_00:00_1971-03-07,Roll_No:Time:Date,0,0
1992-11-26,Brett Harrington,2019259,A-188,9961517213,ok,23:31,Hospital investment imagine.,2019259_23:31_1992-11-26,Roll_No:Time:Date,0,0
1998-02-20,Kristina Spencer,2022473,A-867,7939449462,voice,21:29,Mention professor cell someone.,2022473_21:29_1998-02-20,Roll_No:Time:Date,0,0
1974-02-06,Karen Rodriguez,2018811,A-889,1355192807,power,11:30,Set peace writer skin.,2018811_11:30_1974-02-06,Roll_No:Time:Date,0,0
1986-02-08,Mark Gonzalez,2020592,A-636,9189359809,knowledge,14:53,Not whatever argue everything.,2020592_14:53_1986-02-08,Roll_No:Time:Date,0,0
1980-06-29,Peter Solis,2021464,A-521,1693633167,like,03:18,Test child majority trouble wonder subject let chance.,2021464_03:18_1980-06-29,Roll_No:Time:Date,0,0
2002-02-24,Richard Aguilar,2022139,A-796,1747617865,including,02:53,Seven election former simply career from.,2022139_02:53_2002-02-24,Roll_No:Time:Date,0,0
2018-02-27,Edwin Lee,2020258,A-981,8285388371,together,05:36,Yard public here nearly meeting why social.,2020258_05:36_2018-02-27,Roll_No:Time:Date,0,0
2002-10-30,Joseph Marsh,2020537,A-22,5793896929,war,04:35,Product environment front ball option.,2020537_04:35_2002-10-30,Roll_No:Time:Date,0,0
1994-05-28,Edward Sanchez,2022153,A-571,9370597527,individual,00:45,There eight woman.,2022153_00:45_1994-05-28,Roll_No:Time:Date,0,0
1989-06-16,Molly Smith,2020945,A-66,8205300109,huge,22:52,List down manager community report cost.,2020945_22:52_1989-06-16,Roll_No:Time:Date,0,0
2005-01-30,Donna Li,2018872,A-792,8572734814,home,08:25,Difficult area short.,2018872_08:25_2005-01-30,Roll_No:Time:Date,0,0
1980-03-08,Edward Sanchez,2022153,A-818,9370597527,choice,02:57,Thousand race represent discuss somebody.,2022153_02:57_1980-03-08,Roll_No:Time:Date,0,0
1978-01-04,Wesley Howard,2024866,A-204,3399567270,say,02:30,Sound site exactly indicate she base work eat.,2024866_02:30_1978-01-04,Roll_No:Time:Date,0,0
1990-11-09,Samantha Schmidt,2018794,A-284,2154346783,kitchen,23:46,Green part opportunity later.,2018794_23:46_1990-11-09,Roll_No:Time:Date,0,0
2001-02-20,Julia Odonnell MD,2022564,A-454,615656117,actually,07:46,Charge poor positive actually friend suddenly.,2022564_07:46_2001-02-20,Roll_No:Time:Date,0,0
1993-04-19,Jeremy Hill,2020359,A-993,8496192084,out,12:57,Moment standard probably.,2020359_12:57_1993-04-19,Roll_No:Time:Date,0,0
2005-01-08,Corey Miller,2021027,A-403,4729374882,read,03:04,Must eye lawyer speak though young subject history.,2021027_03:04_2005-01-08,Roll_No:Time:Date,0,0
2008-10-28,Diane Anderson,2019957,A-591,3958205279,approach,01:18,Research large amount question describe light drive.,2019957_01:18_2008-10-28,Roll_No:Time:Date,0,0
2004-03-03,Stephanie Turner,2018311,A-63,1271978401,finally,06:39,She out hot value.,2018311_06:39_2004-03-03,Roll_No:Time:Date,0,0
2009-04-06,Stephanie Turner,2018311,A-879,1271978401,hard,11:14,Current show scientist beat rather sign.,2018311_11:14_2009-04-06,Roll_No:Time:Date,0,0
1971-04-17,Edward Sanchez,2022153,A-560,9370597527,sound,23:55,Total wrong system garden charge.,2022153_23:55_1971-04-17,Roll_No:Time:Date,0,0
2019-06-27,Catherine Patterson,2019872,A-294,670957132,authority,04:31,Sister not send treatment structure song.,2019872_04:31_2019-06-27,Roll_No:Time:Date,0,0
1981-01-07,Dr. Thomas Campbell,2023183,A-556,3515448743,job,22:39,Contain decision program rich.,2023183_22:39_1981-01-07,Roll_No:Time:Date,0,0
1991-07-17,George Schmidt,2023809,A-192,6017355423,arm,20:14,Thank imagine among effort the consider.,2023809_20:14_1991-07-17,Roll_No:Time:Date,0,0
2009-08-23,Laurie Munoz,2024195,A-760,5228553181,soldier,09:13,Hard Mrs anyone situation entire.,2024195_09:13_2009-08-23,Roll_No:Time:Date,0,0
1996-12-17,Janice Salinas,2018558,A-209,1479637646,scene,08:57,Animal magazine ready cultural movement window memory.,2018558_08:57_1996-12-17,Roll_No:Time:Date,0,0
1980-01-29,Brett Harrington,2019259,A-428,9961517213,best,16:42,Really car similar hard this us while.,2019259_16:42_1980-01-29,Roll_No:Time:Date,0,0
1986-02-24,Louis Johnson,2024204,A-493,7574721908,newspaper,21:10,Strategy candidate wind today network.,2024204_21:10_1986-02-24,Roll_No:Time:Date,0,0
1979-03-02,Lisa Sanchez,2023981,A-814,4356063051,rock,01:32,Air cold thus soldier mission what natural.,2023981_01:32_1979-03-02,Roll_No:Time:Date,0,0
2003-02-13,David Cooper,2018858,A-526,1127896198,pretty,18:04,Throw religious north society.,2018858_18:04_2003-02-13,Roll_No:Time:Date,0,0
2007-11-27,Alexander Thompson,2024284,A-855,2393636991,system,06:47,First three reach common production write.,2024284_06:47_2007-11-27,Roll_No:Time:Date,0,0
1971-07-30,Casey Mccullough,2024953,A-457,6327965138,run,07:55,Sister coach cost million.,2024953_07:55_1971-07-30,Roll_No:Time:Date,0,0
2002-02-08,Stephen Hall,2022344,A-191,3245196604,none,00:18,Daughter if plant.,2022344_00:18_2002-02-08,Roll_No:Time:Date,0,0
2020-01-06,Melissa Brown,2024622,A-870,7230156240,drop,13:04,Especially method allow south kid consumer would gun.,2024622_13:04_2020-01-06,Roll_No:Time:Date,0,0
2008-07-14,Veronica Lee,2023586,A-324,3810579232,I,12:55,Single we attention trade Mrs.,2023586_12:55_2008-07-14,Roll_No:Time:Date,0,0
2010-05-05,Thomas Perkins,2018996,A-451,8088149892,establish,06:12,Those become knowledge sister international evidence.,2018996_06:12_2010-05-05,Roll_No:Time:Date,0,0
2001-03-31,Veronica Christian,2023178,A-797,8161031420,well,01:50,Information worker research.,2023178_01:50_2001-03-31,Roll_No:Time:Date,0,0
1994-08-21,Aaron Banks,2021813,A-433,3080000562,her,14:49,Production question whose statement statement cover hour.,2021813_14:49_1994-08-21,Roll_No:Time:Date,0,0
2020-11-16,Stephanie Turner,2018311,A-194,1271978401,scene,06:26,Finish particularly anything series whatever so continue.,2018311_06:26_2020-11-16,Roll_No:Time:Date,0,0
1983-11-11,Veronica Lee,2023586,A-882,3810579232,book,02:08,Against prepare health summer amount sound just.,2023586_02:08_1983-11-11,Roll_No:Time:Date,0,0
1992-09-07,Elizabeth Hammond,2022025,A-256,5464112426,soldier,07:49,Safe on other federal two society.,2022025_07:49_1992-09-07,Roll_No:Time:Date,0,0
1996-06-24,Jesse Wagner,2019787,A-38,9319349285,value,02:09,Detail adult choose window party marriage.,2019787_02:09_1996-06-24,Roll_No:Time:Date,0,0
2010-05-28,Samantha Schmidt,2018794,A-920,2154346783,share,11:55,Wife room system open.,2018794_11:55_2010-05-28,Roll_No:Time:Date,0,0
1983-09-10,Michael Wood,2018991,A-143,9766545866,how,22:40,Open you radio care.,2018991_22:40_1983-09-10,Roll_No:Time:Date,0,0
1996-06-01,Stephen Sheppard MD,2021432,A-619,804281864,past,20:53,Enjoy start happy trial real show summer accept.,2021432_20:53_1996-06-01,Roll_No:Time:Date,0,0
1970-08-04,Gabrielle Bennett,2018237,A-871,416669641,recent,23:25,East its just senior send truth table.,2018237_23:25_1970-08-04,Roll_No:Time:Date,0,0
1994-01-25,Bonnie Jackson,2024162,A-128,5334978755,building,12:48,After down interest they available southern tax.,2024162_12:48_1994-01-25,Roll_No:Time:Date,0,0
1979-10-20,Karen Rodriguez,2018811,A-377,1355192807,send,03:28,Election three produce fly final hit station.,2018811_03:28_1979-10-20,Roll_No:Time:Date,0,0
1982-10-16,Roberto Chaney Jr.,2022246,A-263,5862951154,college,19:08,Organization write and sort summer.,2022246_19:08_1982-10-16,Roll_No:Time:Date,0,0
1977-02-06,Casey Mccullough,2024953,A-31,6327965138,security,18:43,Which put almost author indicate.,2024953_18:43_1977-02-06,Roll_No:Time:Date,0,0
2002-12-26,Peter Solis,2021464,A-486,1693633167,claim,02:49,Wife goal call movie power.,2021464_02:49_2002-12-26,Roll_No:Time:Date,0,0
1981-05-31,James Phillips,2019236,A-907,1619848220,feeling,19:16,Suffer design available visit treat.,2019236_19:16_1981-05-31,Roll_No:Time:Date,0,0
2017-01-24,Bonnie Jackson,2024162,A-151,5334978755,laugh,19:42,Yes or this water decide own data improve.,2024162_19:42_2017-01-24,Roll_No:Time:Date,0,0
1988-08-02,Alexandria Douglas DDS,2023908,A-218,2719757270,employee,02:30,Economy traditional religious Congress.,2023908_02:30_1988-08-02,Roll_No:Time:Date,0,0
2007-07-04,Veronica Lee,2023586,A-986,3810579232,mouth,11:39,Get represent without.,2023586_11:39_2007-07-04,Roll_No:Time:Date,0,0
2022-08-19,Marvin Hale,2021708,A-219,9710127211,do,22:35,Foreign where boy agency despite level food.,2021708_22:35_2022-08-19,Roll_No:Time:Date,0,0
1980-04-16,Donna Li,2018872,A-918,8572734814,company,16:43,Write either pay down once half point.,2018872_16:43_1980-04-16,Roll_No:Time:Date,0,0
1975-03-16,Janice Salinas,2018558,A-746,1479637646,follow,06:21,Either guy detail style claim likely act.,2018558_06:21_1975-03-16,Roll_No:Time:Date,0,0
1989-04-12,Janice Salinas,2018558,A-765,1479637646,summer,01:06,System act same reality something better.,2018558_01:06_1989-04-12,Roll_No:Time:Date,0,0
2022-05-31,Corey Miller,2021027,A-988,4729374882,seat,07:52,Use lead drive there care keep.,2021027_07:52_2022-05-31,Roll_No:Time:Date,0,0
1985-09-17,Kristina Spencer,2022473,A-795,7939449462,behind,16:21,Sea enjoy color resource.,2022473_16:21_1985-09-17,Roll_No:Time:Date,0,0
1999-11-12,Veronica Lee,2023586,A-826,3810579232,far,14:19,Lead attention feeling major.,2023586_14:19_1999-11-12,Roll_No:Time:Date,0,0
2015-07-11,Robert Powell,2018986,A-820,3177268454,trip,21:59,Participant generation imagine fly out hand foreign.,2018986_21:59_2015-07-11,Roll_No:Time:Date,0,0
2016-09-30,Benjamin Ibarra,2023363,A-726,9650137531,Congress,15:05,Win serious morning machine because decade way.,2023363_15:05_2016-09-30,Roll_No:Time:Date,0,0
1975-09-26,Frank Kennedy,2022773,A-484,6954046242,job,22:38,Present American movie chair southern analysis travel.,2022773_22:38_1975-09-26,Roll_No:Time:Date,0,0
1975-01-20,Stephen Sheppard MD,2021432,A-985,804281864,woman,05:01,Improve later Republican western.,2021432_05:01_1975-01-20,Roll_No:Time:Date,0,0
1981-03-12,Jasmin Moore,2024058,A-15,1096451576,player,11:38,House show plant continue.,2024058_11:38_1981-03-12,Roll_No:Time:Date,0,0
1993-03-05,Lisa Sanchez,2023981,A-215,4356063051,fall,21:34,Stuff also when else make evening painting.,2023981_21:34_1993-03-05,Roll_No:Time:Date,0,0
2011-02-10,Laura Johnson,2021458,A-304,8429532285,maintain,11:31,Time firm manage forward.,2021458_11:31_2011-02-10,Roll_No:Time:Date,0,0
2022-02-28,Richard Aguilar,2022139,A-957,1747617865,form,09:00,Compare price clear mouth civil meet.,2022139_09:00_2022-02-28,Roll_No:Time:Date,0,0
1973-06-28,Tanya Moore,2020486,A-104,5451314750,among,12:50,Year themselves support run.,2020486_12:50_1973-06-28,Roll_No:Time:Date,0,0
1994-05-23,Alexander Thompson,2024284,A-648,2393636991,oil,17:49,Without develop easy put.,2024284_17:49_1994-05-23,Roll_No:Time:Date,0,0
2008-07-09,Denise Williams,2018108,A-209,5159574235,create,10:25,Including success popular many fact.,2018108_10:25_2008-07-09,Roll_No:Time:Date,0,0
1992-07-10,Allen Rogers,2022383,A-278,6117019160,son,00:57,Adult story sure against skin.,2022383_00:57_1992-07-10,Roll_No:Time:Date,0,0
