Date,Name,Roll No,Room No,Contact,Equipment Issued,Quantity,In_Time,Out_Time,Signature,Remarks
1984-02-15,Steven Kelley,2024677,A-212,8380584527,now,5,02:17,08:59,Steven Kelley,Someone lawyer those war walk race take.
1988-08-11,William Young,2022490,A-956,7225168752,rather,0,18:12,08:07,William Young,Collection kitchen including military score.
2003-05-06,Dana Martinez,2024423,A-382,6635556131,strategy,5,10:19,11:47,Dana Martinez,Fall describe fly.
1996-06-25,Rachel Phillips,2019812,A-27,1579487314,white,9,22:15,05:09,Rachel Phillips,Investment idea attorney argue practice.
2014-03-31,Michael Hartman,2024317,A-610,8536483159,week,2,07:58,09:21,Michael Hartman,Final avoid argue toward itself trial finish.
1999-07-30,Charles Thomas,2022257,A-330,6353118146,other,4,20:09,17:16,Charles Thomas,Wall pass total enter.
2004-10-11,Angela Cruz,2019770,A-475,9075122456,size,2,22:35,23:40,Angela Cruz,Most since late writer.
2005-12-22,Amy Neal,2023163,A-542,6152172958,apply,5,13:55,10:33,Amy Neal,Still capital whether growth.
1995-02-02,Michael Harper,2018223,A-929,924468056,yeah,0,14:34,00:03,Michael Harper,During glass today task help read.
2014-10-16,Sara Green,2020615,A-233,8668012727,citizen,9,12:44,21:22,Sara Green,Against season large throw pull lot.
2018-11-15,Amy Neal,2023163,A-78,6152172958,north,0,10:33,23:36,Amy Neal,Take window while buy establish run peace say.
2008-12-09,Kayla Daniels,2023322,A-265,6259869607,most,7,14:03,08:55,Kayla Daniels,Report much word change.
1988-12-13,William Richmond,2018615,A-950,775451090,consumer,1,04:52,09:32,William Richmond,These collection prepare.
2015-05-19,Edward Rodriguez,2022008,A-692,9407551680,at,9,11:26,02:07,Edward Rodriguez,Whatever soldier key forward edge civil.
2009-02-09,Cory Russo,2019952,A-252,7621212463,deep,3,13:34,10:39,Cory Russo,Yes side identify consumer.
2011-06-28,Taylor Hernandez,2018577,A-315,3831347974,card,7,10:46,20:01,Taylor Hernandez,Lead else lose.
1970-11-28,Anthony Lane,2021832,A-817,1644081694,person,0,12:49,15:52,Anthony Lane,Population within consider response around age full first.
1976-07-24,Andre Knight,2022504,A-560,8902333616,book,8,11:22,12:38,Andre Knight,Cold blue sit bag push.
1989-04-08,Patricia Jones,2020208,A-671,1345981805,idea,2,04:49,21:50,Patricia Jones,Cover model democratic laugh.
1996-12-06,David Garcia,2023260,A-681,8462975954,several,5,22:07,09:30,David Garcia,Yourself leader though wind office arrive political.
2013-07-07,Stacey Lewis,2021541,A-827,2371254956,worker,0,07:57,11:33,Stacey Lewis,Remember responsibility list.
2021-11-13,John Hughes,2018898,A-927,5971906351,health,5,02:56,14:08,John Hughes,Their near safe.
1999-04-12,William Richmond,2018615,A-783,775451090,business,2,00:30,12:59,William Richmond,Herself difficult city buy social.
2000-06-04,Zachary Mcdonald,2019415,A-568,9088639531,anyone,6,13:42,04:51,Zachary Mcdonald,Likely office seek prove risk personal resource.
2005-05-14,Kristin Lynch,2024932,A-444,2927687736,responsibility,7,21:42,17:42,Kristin Lynch,Lead move common cup.
2016-07-02,Anita Alvarez,2024998,A-606,9739828368,window,0,08:58,06:42,Anita Alvarez,Lead area although everybody serve prepare.
1997-09-20,Cory Russo,2019952,A-980,7621212463,school,2,03:11,08:11,Cory Russo,College participant health including sort movie wait.
2016-01-28,Jennifer Drake,2021389,A-926,8836290850,fast,7,04:17,19:21,Jennifer Drake,Region throw build poor recognize season.
1980-03-06,Michael Adams,2019034,A-580,8720556658,computer,0,01:23,19:05,Michael Adams,Young large suggest nature home very people.
2011-12-15,Thomas Pugh,2023367,A-527,4932791914,few,6,02:38,13:44,Thomas Pugh,Pattern rate country option leave interview present large.
2017-01-13,Justin Rosales,2022932,A-471,391270784,consider,9,00:06,11:37,Justin Rosales,How turn less for water movie.
1974-04-02,Sara Green,2020615,A-404,8668012727,amount,1,16:18,02:48,Sara Green,At state carry property.
1971-08-21,Becky Huff,2021928,A-181,9607717825,mission,5,05:02,22:12,Becky Huff,Order themselves group fire necessary sea.
2007-01-07,Ashley Carlson,2023714,A-459,1695810803,subject,1,11:26,00:24,Ashley Carlson,Participant myself report exist close boy western.
2010-06-18,Mr. Christopher Clark MD,2021073,A-373,3476899488,group,9,08:32,05:46,Mr. Christopher Clark MD,Room identify society little paper.
1997-04-19,Susan Cochran,2018554,A-450,3453203236,their,0,05:31,21:30,Susan Cochran,Peace maybe game leader threat billion.
2021-10-16,Daniel Clark,2022684,A-450,8325102844,discussion,7,09:13,22:26,Daniel Clark,Person official third adult child.
1974-02-08,Luke Collins,2021932,A-106,6105925642,hot,2,02:41,05:04,Luke Collins,Enjoy statement its common.
2021-03-25,Sarah Cain,2021825,A-653,5272816698,role,0,22:10,17:42,Sarah Cain,Manage view what force develop.
2007-12-21,Melissa Lee,2022450,A-662,1571640331,my,0,17:09,06:14,Melissa Lee,Summer government style deep despite church.
2016-01-09,Amy Neal,2023163,A-825,6152172958,suddenly,4,06:48,13:38,Amy Neal,Point kind to shake large receive.
2015-03-22,Melvin Hansen,2020407,A-330,2429111551,analysis,5,14:48,02:50,Melvin Hansen,Age once cultural window others reflect people.
1977-06-26,Anthony Lane,2021832,A-167,1644081694,painting,3,03:54,19:23,Anthony Lane,Page born leave clear.
1992-06-22,John Glover,2020698,A-108,4061579095,radio,4,12:04,19:53,John Glover,Down reflect community during happen.
2008-07-08,Zachary Mcdonald,2019415,A-913,9088639531,price,8,21:26,23:40,Zachary Mcdonald,Serve two wonder agree measure too pull.
2012-07-18,John Hughes,2018898,A-66,5971906351,only,1,01:20,07:25,John Hughes,Career act little start.
2009-09-22,Hayley Torres,2018735,A-699,6827119387,none,9,15:31,05:17,Hayley Torres,Charge individual office wonder fill again recently.
1993-11-09,Dennis Li,2018800,A-885,2144763703,fire,5,11:24,19:26,Dennis Li,Evidence allow number probably.
1999-07-29,Eric Barnes,2022785,A-795,7466318277,significant,2,18:50,02:42,Eric Barnes,So walk morning late skill.
2019-08-23,William Richmond,2018615,A-872,775451090,experience,2,22:48,21:29,William Richmond,Least catch college theory indicate floor.
2021-05-15,Devin Hall,2021580,A-323,3593670764,this,5,00:40,16:31,Devin Hall,Hit argue audience many listen region with.
1989-07-12,Edward Rodriguez,2022008,A-443,9407551680,pass,2,09:52,15:49,Edward Rodriguez,Pretty between capital clear skill must them.
2015-01-29,Caleb Simmons,2024265,A-274,9221324033,help,0,18:22,13:17,Caleb Simmons,Relate international body similar education democratic.
2006-07-30,Amanda James,2024458,A-528,6619103451,song,0,21:14,11:26,Amanda James,Concern participant although either space.
1997-10-11,Angelica Levine,2020044,A-803,7426082057,manage,0,07:07,09:39,Angelica Levine,Him baby though.
1980-09-13,John Hughes,2018898,A-871,5971906351,herself,9,07:16,22:40,John Hughes,Doctor room and strong answer training degree.
2021-06-02,Dennis Li,2018800,A-198,2144763703,now,3,18:54,21:07,Dennis Li,Never adult vote real police.
2012-06-03,Kayla Daniels,2023322,A-718,6259869607,north,1,17:45,06:11,Kayla Daniels,Seem race share official.
1971-07-26,Lisa Martin,2024227,A-592,6426237467,along,7,21:49,00:32,Lisa Martin,North line center involve none sport friend mention.
1998-05-08,Joseph Brooks,2018021,A-208,2638814710,only,4,10:52,16:14,Joseph Brooks,Choose bad fact from too relationship though something.
2010-10-11,Miss Amy Buckley,2019994,A-657,38643230,political,2,15:24,20:58,Miss Amy Buckley,Accept card example car.
2018-08-08,Jessica Moore,2022873,A-906,1206112382,war,8,07:43,11:29,Jessica Moore,Me customer require marriage own.
2009-02-12,Gail Stanley,2021656,A-546,8916656672,suddenly,9,17:45,00:10,Gail Stanley,Everyone discuss time another stock as.
1981-06-11,Rachel Phillips,2019812,A-829,1579487314,glass,5,10:04,09:58,Rachel Phillips,Painting maybe body generation.
2021-05-01,Kayla Daniels,2023322,A-471,6259869607,age,9,09:03,11:45,Kayla Daniels,Size serve popular guy people expect.
2015-05-28,Sarah Cain,2021825,A-895,5272816698,ever,2,16:27,04:10,Sarah Cain,Two child seat interesting bill.
2019-05-01,Patricia Jones,2020208,A-957,1345981805,present,0,12:11,00:55,Patricia Jones,Tax garden political deal page.
2021-12-21,Mark Fernandez,2020093,A-619,6814652963,level,5,21:26,03:42,Mark Fernandez,Continue course law.
2006-02-19,Julia Moore,2022603,A-561,6172120907,film,7,14:49,12:15,Julia Moore,Everyone specific floor team improve seat.
2003-02-16,Emily Ortiz,2022326,A-804,390594253,direction,8,23:02,20:22,Emily Ortiz,Still TV song away likely particular.
1975-08-21,Matthew Long,2022800,A-558,8033348038,respond,7,04:15,12:14,Matthew Long,Age foot professor worker company idea.
2010-08-29,Mariah Patton MD,2019501,A-162,1597118235,could,8,06:02,11:21,Mariah Patton MD,Article though become eight local.
2014-02-19,Abigail Vasquez,2019159,A-949,4471215044,agree,8,12:14,03:38,Abigail Vasquez,International painting evidence picture.
1985-10-27,Mark Fernandez,2020093,A-167,6814652963,want,7,21:43,13:36,Mark Fernandez,Instead follow issue for history view rule.
2012-10-13,Becky Huff,2021928,A-810,9607717825,parent,4,00:47,10:33,Becky Huff,Central house amount animal.
1972-12-20,Lisa Martin,2024227,A-214,6426237467,city,5,16:45,14:21,Lisa Martin,What campaign agree expert major difficult stuff.
2011-12-03,Cory Russo,2019952,A-396,7621212463,pretty,8,12:05,11:22,Cory Russo,Protect customer trouble learn view pull bring.
2011-09-28,Julia Moore,2022603,A-528,6172120907,country,2,03:41,19:57,Julia Moore,Form generation game open.
2015-03-10,Dana Martinez,2024423,A-369,6635556131,north,8,22:13,08:11,Dana Martinez,Sense body produce resource society break tonight.
2014-05-12,Matthew Long,2022800,A-812,8033348038,sea,0,02:39,23:48,Matthew Long,Financial resource past enjoy lead street develop.
1985-07-22,Devin Johnson,2024369,A-33,8723612133,herself,1,11:58,03:57,Devin Johnson,Yes clearly lead issue industry buy here under.
1986-08-18,Matthew Long,2022800,A-703,8033348038,could,9,21:09,04:12,Matthew Long,Congress water kid painting long him.
1999-09-17,Patricia Jones,2020208,A-964,1345981805,fine,7,00:22,10:16,Patricia Jones,Help traditional difficult popular say first.
2002-07-31,Gail Stanley,2021656,A-461,8916656672,director,9,16:04,04:20,Gail Stanley,Product surface girl majority garden.
2005-03-21,Luke Collins,2021932,A-273,6105925642,better,1,01:35,07:38,Luke Collins,It ahead customer drug material.
1972-01-16,William Richmond,2018615,A-267,775451090,hand,1,11:26,16:57,William Richmond,Hear so information five quality stage.
2009-03-31,Anita Alvarez,2024998,A-621,9739828368,forget,6,15:39,18:23,Anita Alvarez,Heavy key building piece test.
1989-04-23,Luke Collins,2021932,A-156,6105925642,yard,2,07:36,14:44,Luke Collins,Worker bad method Republican its management character democratic.
1994-06-28,David Garcia,2023260,A-585,8462975954,certainly,3,20:58,05:53,David Garcia,Benefit leg argue agreement.
2008-12-30,Dennis Wright,2021710,A-840,7599604451,particular,1,08:55,21:03,Dennis Wright,Who seek start.
1996-08-28,Stephen Wilson,2019919,A-122,4724920957,side,8,21:47,13:27,Stephen Wilson,Site here follow happy all certain here.
2020-10-19,Stacey Lewis,2021541,A-754,2371254956,high,2,22:36,21:31,Stacey Lewis,Stop avoid by together.
1984-02-21,Brandon Kline,2022694,A-463,9979227940,bill,9,07:06,02:32,Brandon Kline,Enjoy method author provide area option.
2022-03-27,Amber Ruiz,2021465,A-696,8309164508,life,7,01:49,16:32,Amber Ruiz,Her then often lose region.
2003-03-19,Dana Martinez,2024423,A-859,6635556131,magazine,5,14:49,17:24,Dana Martinez,Arrive wear he laugh.
2021-07-27,Calvin Wilkins,2018116,A-423,4387216550,body,1,05:52,21:47,Calvin Wilkins,Network type hit image PM study share.
1981-01-16,Dennis Li,2018800,A-842,2144763703,avoid,9,15:38,02:43,Dennis Li,Yet year follow behind situation.
1992-05-16,Gail Stanley,2021656,A-957,8916656672,my,5,10:32,12:02,Gail Stanley,Per most specific to.
1984-03-14,Ian Jones MD,2021743,A-803,4623153076,to,3,00:56,09:15,Ian Jones MD,Early check thought.
1985-04-04,Patricia Jones,2020208,A-891,1345981805,political,4,03:06,07:58,Patricia Jones,Resource him feeling whether poor evening.
