Date,Name,Roll No,Room No,Contact,Equipment,Time,Remarks,Unique_Key,Key_Combination,LookUp_Count,Update_Count
1974-03-19,Tyler Shaw,2024966,A-633,9014638486,senior,03:36,Article fly something lose student evidence strong.,2024966_03:36_1974-03-19,Roll_No:Time:Date,0,0
2019-09-13,Brandy Simpson,2023810,A-391,8168970318,station,06:21,Tell stop real throughout century entire claim.,2023810_06:21_2019-09-13,Roll_No:Time:Date,0,0
1981-12-18,Robin Powell,2020731,A-102,3464208399,include,00:17,Wall car environmental.,2020731_00:17_1981-12-18,Roll_No:Time:Date,0,0
1997-01-26,Vanessa Sullivan,2020379,A-660,9714598329,there,23:13,Ago hundred there forget.,2020379_23:13_1997-01-26,Roll_No:Time:Date,0,0
2011-09-23,Robert Alexander,2018100,A-862,7823670856,science,13:26,Any produce final raise.,2018100_13:26_2011-09-23,Roll_No:Time:Date,0,0
2019-10-13,Bruce Holloway,2022617,A-577,3501755546,every,00:58,Style author recent parent simply energy.,2022617_00:58_2019-10-13,Roll_No:Time:Date,0,0
2013-05-10,Joseph Garcia,2022370,A-745,9267004912,bit,16:03,Main hour big article.,2022370_16:03_2013-05-10,Roll_No:Time:Date,0,0
1987-03-29,Thomas Norton,2022852,A-46,4580655054,of,16:28,Major billion say charge former of.,2022852_16:28_1987-03-29,Roll_No:Time:Date,0,0
1997-04-08,Jacob Archer,2024204,A-320,7235077166,movie,01:45,Standard business minute dinner almost.,2024204_01:45_1997-04-08,Roll_No:Time:Date,0,0
2010-12-07,Angela Carroll,2019898,A-637,504876150,describe,15:41,Pm school industry begin maintain despite.,2019898_15:41_2010-12-07,Roll_No:Time:Date,0,0
1991-08-11,Jennifer Walter,2024387,A-91,2960191117,similar,12:12,Away election majority accept lead perform at.,2024387_12:12_1991-08-11,Roll_No:Time:Date,0,0
1973-10-07,Christian Hicks,2024876,A-632,373015252,everyone,00:35,Value movie do instead series since ok.,2024876_00:35_1973-10-07,Roll_No:Time:Date,0,0
1999-03-28,Bruce Holloway,2022617,A-180,3501755546,generation,12:38,Quickly throw economy serve.,2022617_12:38_1999-03-28,Roll_No:Time:Date,0,0
1997-10-07,Scott Frank,2019058,A-558,1933091010,debate,14:03,Dark image social water price reality difference.,2019058_14:03_1997-10-07,Roll_No:Time:Date,0,0
2014-08-16,Brandy Simpson,2023810,A-906,8168970318,participant,18:37,Pay finish bill space very simply.,2023810_18:37_2014-08-16,Roll_No:Time:Date,0,0
2013-10-03,Matthew Meyer,2024936,A-477,2846982432,child,09:19,Degree ball really language bit wife.,2024936_09:19_2013-10-03,Roll_No:Time:Date,0,0
2013-09-24,Jessica Sanchez,2023478,A-140,7481401703,run,08:01,Material animal head hour.,2023478_08:01_2013-09-24,Roll_No:Time:Date,0,0
1992-09-14,Kimberly Boyd,2022823,A-757,2206364875,decade,00:44,Nor grow food recently star operation.,2022823_00:44_1992-09-14,Roll_No:Time:Date,0,0
1986-09-09,Tammy Williams,2019481,A-980,5715219695,truth,14:46,Individual herself serve loss.,2019481_14:46_1986-09-09,Roll_No:Time:Date,0,0
1975-06-15,Stephanie Williams,2023496,A-357,5534343679,growth,21:35,Smile show his decade after.,2023496_21:35_1975-06-15,Roll_No:Time:Date,0,0
2001-09-14,Jill Cole,2023298,A-418,1847012027,doctor,22:17,Thought institution college argue plan choose.,2023298_22:17_2001-09-14,Roll_No:Time:Date,0,0
1984-12-02,Dr. Stephanie Barajas,2024400,A-11,870228137,military,04:05,Art public person relationship.,2024400_04:05_1984-12-02,Roll_No:Time:Date,0,0
2010-03-05,Christian Hicks,2024876,A-447,373015252,reality,20:56,Tax rest hard degree sing step.,2024876_20:56_2010-03-05,Roll_No:Time:Date,0,0
1994-02-08,Brian Young,2024572,A-993,161456648,question,17:24,Which capital treat only.,2024572_17:24_1994-02-08,Roll_No:Time:Date,0,0
1992-04-28,Monique Dougherty,2020655,A-105,8459562024,look,23:42,If experience system mouth often detail leave.,2020655_23:42_1992-04-28,Roll_No:Time:Date,0,0
1980-12-24,Colleen Barnett,2019831,A-611,8696915185,at,10:34,Quite land part important low wonder list.,2019831_10:34_1980-12-24,Roll_No:Time:Date,0,0
1993-04-04,Vanessa Sullivan,2020379,A-183,9714598329,remain,15:48,Become population major goal sister.,2020379_15:48_1993-04-04,Roll_No:Time:Date,0,0
1991-09-07,Jill Cole,2023298,A-134,1847012027,father,04:38,Entire parent Congress news.,2023298_04:38_1991-09-07,Roll_No:Time:Date,0,0
2008-08-19,Christian Hicks,2024876,A-233,373015252,politics,19:33,Fine policy usually final strong.,2024876_19:33_2008-08-19,Roll_No:Time:Date,0,0
2021-12-07,Rebecca Brown,2023076,A-285,9340776167,throughout,19:29,There management put possible conference north energy black.,2023076_19:29_2021-12-07,Roll_No:Time:Date,0,0
2007-06-14,Cheryl Miller,2018692,A-468,885140684,news,14:27,Large magazine employee.,2018692_14:27_2007-06-14,Roll_No:Time:Date,0,0
2021-05-28,Dr. Stephanie Barajas,2024400,A-921,870228137,place,04:33,Black cost husband establish every produce.,2024400_04:33_2021-05-28,Roll_No:Time:Date,0,0
2019-10-08,Sandra Trevino,2020928,A-625,7903944941,similar,17:03,Ahead six foot happen dark lay hotel.,2020928_17:03_2019-10-08,Roll_No:Time:Date,0,0
2002-04-11,Dr. Stephanie Barajas,2024400,A-523,870228137,almost,04:53,Few after half try during thing million.,2024400_04:53_2002-04-11,Roll_No:Time:Date,0,0
1992-06-15,Jake Duncan,2020727,A-535,4304459942,into,21:04,Majority fill wind because letter medical body head.,2020727_21:04_1992-06-15,Roll_No:Time:Date,0,0
1984-02-05,Bryan Obrien,2018992,A-427,6906696490,house,19:59,Space while project be.,2018992_19:59_1984-02-05,Roll_No:Time:Date,0,0
1976-11-21,Jacob Walton,2024177,A-785,4648991176,than,04:21,Affect political address rest third middle.,2024177_04:21_1976-11-21,Roll_No:Time:Date,0,0
2002-08-29,Gregory Hill,2020627,A-101,7020446017,change,16:21,Those career word explain.,2020627_16:21_2002-08-29,Roll_No:Time:Date,0,0
1991-09-04,Brian Garcia,2020267,A-646,3601686976,both,22:11,New administration book source capital laugh indeed.,2020267_22:11_1991-09-04,Roll_No:Time:Date,0,0
1989-08-26,Sara Tucker,2023594,A-422,8409301086,bring,02:13,Story audience history nothing here.,2023594_02:13_1989-08-26,Roll_No:Time:Date,0,0
2005-05-17,Brandy Simpson,2023810,A-520,8168970318,city,01:15,Off president still where sort effect.,2023810_01:15_2005-05-17,Roll_No:Time:Date,0,0
2011-11-06,Pamela Burch,2018267,A-20,5072685352,past,00:24,Successful many future economy.,2018267_00:24_2011-11-06,Roll_No:Time:Date,0,0
2008-06-04,Morgan Jordan,2018807,A-807,1520849742,kind,20:37,Name cultural civil garden would public minute film.,2018807_20:37_2008-06-04,Roll_No:Time:Date,0,0
1979-03-21,Amy Patrick,2020509,A-171,4259908199,key,08:36,Budget religious Congress total if building company.,2020509_08:36_1979-03-21,Roll_No:Time:Date,0,0
1998-10-19,Vanessa Sullivan,2020379,A-566,9714598329,commercial,12:10,Late wait teacher develop.,2020379_12:10_1998-10-19,Roll_No:Time:Date,0,0
2015-11-13,James Johnson,2020759,A-897,8345297330,oil,13:00,Whose source pay population among of.,2020759_13:00_2015-11-13,Roll_No:Time:Date,0,0
1988-12-15,Tina Caldwell,2020728,A-132,6535825551,rate,15:35,Position total long if scientist stock fill.,2020728_15:35_1988-12-15,Roll_No:Time:Date,0,0
1979-05-31,Morgan Jordan,2018807,A-880,1520849742,long,02:44,Hot little during animal.,2018807_02:44_1979-05-31,Roll_No:Time:Date,0,0
1972-10-29,Robert Alexander,2018100,A-691,7823670856,mention,19:11,Brother help step here network.,2018100_19:11_1972-10-29,Roll_No:Time:Date,0,0
1999-11-05,Doris Nelson,2021416,A-45,4926029801,campaign,17:09,Support it although way.,2021416_17:09_1999-11-05,Roll_No:Time:Date,0,0
2008-01-10,Thomas Norton,2022852,A-742,4580655054,herself,00:25,Mouth particularly record again.,2022852_00:25_2008-01-10,Roll_No:Time:Date,0,0
2007-02-18,Adam Diaz,2019745,A-204,476940691,large,08:25,Book forward add.,2019745_08:25_2007-02-18,Roll_No:Time:Date,0,0
2017-02-05,James Johnson,2020759,A-815,8345297330,project,02:43,Cell theory month beautiful door surface certainly.,2020759_02:43_2017-02-05,Roll_No:Time:Date,0,0
1998-04-12,Brian Ruiz,2022911,A-301,6094717481,road,12:52,Something buy job answer property general third.,2022911_12:52_1998-04-12,Roll_No:Time:Date,0,0
2015-04-16,Alejandro Wilson,2023318,A-963,4711390400,way,16:12,School may tough authority hour address.,2023318_16:12_2015-04-16,Roll_No:Time:Date,0,0
1997-12-24,Karen Jones,2022976,A-898,5605359205,hair,15:58,Standard everyone thought provide western defense.,2022976_15:58_1997-12-24,Roll_No:Time:Date,0,0
1993-06-13,Jacob Archer,2024204,A-40,7235077166,eat,20:40,Price cup lot mind heart camera.,2024204_20:40_1993-06-13,Roll_No:Time:Date,0,0
2018-03-09,Matthew Meyer,2024936,A-344,2846982432,avoid,23:58,Through edge fine capital year well age performance.,2024936_23:58_2018-03-09,Roll_No:Time:Date,0,0
1984-06-29,Doris Nelson,2021416,A-744,4926029801,begin,13:15,Similar because every certainly fire recent.,2021416_13:15_1984-06-29,Roll_No:Time:Date,0,0
2013-10-07,Michelle Underwood,2024900,A-213,1724825272,nice,02:27,You several brother only morning.,2024900_02:27_2013-10-07,Roll_No:Time:Date,0,0
1980-06-29,James Neal,2022926,A-27,3310510594,group,05:05,Edge course to bit shoulder environment.,2022926_05:05_1980-06-29,Roll_No:Time:Date,0,0
2004-06-29,Sara Tucker,2023594,A-904,8409301086,scene,19:41,North responsibility safe today traditional campaign for.,2023594_19:41_2004-06-29,Roll_No:Time:Date,0,0
2014-03-19,Jill Cole,2023298,A-254,1847012027,meeting,18:02,Either theory early action sometimes agency middle.,2023298_18:02_2014-03-19,Roll_No:Time:Date,0,0
2006-12-31,Daniel Edwards,2020560,A-505,5501753680,Democrat,02:40,Commercial method term bring scene ago.,2020560_02:40_2006-12-31,Roll_No:Time:Date,0,0
2017-01-19,Patricia Porter,2019690,A-188,8990833014,best,15:02,Agree support even simple red fire.,2019690_15:02_2017-01-19,Roll_No:Time:Date,0,0
1980-11-14,Courtney Peterson,2023296,A-604,4255071997,population,12:34,Anyone camera tell campaign.,2023296_12:34_1980-11-14,Roll_No:Time:Date,0,0
2012-05-10,Ashley Smith,2018311,A-425,1368269397,southern,22:00,Red step military general.,2018311_22:00_2012-05-10,Roll_No:Time:Date,0,0
1985-04-18,Vanessa Sullivan,2020379,A-558,9714598329,small,05:07,Mouth peace chance drop star than.,2020379_05:07_1985-04-18,Roll_No:Time:Date,0,0
1993-11-16,Karen Jones,2022976,A-309,5605359205,alone,15:10,Race tonight hit cover college.,2022976_15:10_1993-11-16,Roll_No:Time:Date,0,0
1978-11-18,Jill Cole,2023298,A-425,1847012027,practice,10:50,Commercial point technology.,2023298_10:50_1978-11-18,Roll_No:Time:Date,0,0
1978-11-22,Desiree Griffin,2024212,A-484,2516235824,represent,01:42,Spend ready society even those model.,2024212_01:42_1978-11-22,Roll_No:Time:Date,0,0
2002-02-21,Jill Cole,2023298,A-829,1847012027,could,17:57,Happen laugh read knowledge.,2023298_17:57_2002-02-21,Roll_No:Time:Date,0,0
2010-03-13,Kevin Soto,2019620,A-316,4849826939,camera,23:11,Ok contain my upon.,2019620_23:11_2010-03-13,Roll_No:Time:Date,0,0
2021-03-24,Joseph Gibson,2023333,A-893,9291108990,person,19:04,Police series military wear light reveal.,2023333_19:04_2021-03-24,Roll_No:Time:Date,0,0
2017-07-24,Daniel Wright,2021138,A-267,6437651435,right,21:30,Play Republican draw marriage hair power.,2021138_21:30_2017-07-24,Roll_No:Time:Date,0,0
1994-12-09,Brooke Ferguson,2020232,A-824,8469472389,collection,06:27,Enough theory usually.,2020232_06:27_1994-12-09,Roll_No:Time:Date,0,0
1970-02-16,Cory Campbell,2023729,A-475,5292402586,memory,18:22,Center administration every claim girl after Republican culture.,2023729_18:22_1970-02-16,Roll_No:Time:Date,0,0
2008-02-27,Tina Caldwell,2020728,A-132,6535825551,outside,10:41,Full thus write apply interest.,2020728_10:41_2008-02-27,Roll_No:Time:Date,0,0
2021-10-16,Timothy Bennett III,2021392,A-358,6794568564,and,10:19,Memory a production single music cell street.,2021392_10:19_2021-10-16,Roll_No:Time:Date,0,0
1978-09-14,James Johnson,2020759,A-379,8345297330,another,20:47,Eight particular source scientist language training.,2020759_20:47_1978-09-14,Roll_No:Time:Date,0,0
1998-11-17,Scott Hayes,2023379,A-537,6786536293,investment,18:35,Million drive many cover.,2023379_18:35_1998-11-17,Roll_No:Time:Date,0,0
2013-05-26,Derek Russell,2019162,A-370,4397793320,relationship,01:47,Reveal window tough natural.,2019162_01:47_2013-05-26,Roll_No:Time:Date,0,0
2011-04-15,Jacob Higgins,2019725,A-420,119647988,south,05:25,Animal read strategy occur by.,2019725_05:25_2011-04-15,Roll_No:Time:Date,0,0
1985-08-01,Joseph Hamilton,2024727,A-701,5490380350,into,07:23,Bad light film explain stuff bad.,2024727_07:23_1985-08-01,Roll_No:Time:Date,0,0
1985-07-09,Scott Hayes,2023379,A-963,6786536293,ever,16:29,Development former system doctor.,2023379_16:29_1985-07-09,Roll_No:Time:Date,0,0
1981-01-06,Christy Garcia,2020331,A-224,7568432150,argue,10:46,Effort individual door near represent buy almost.,2020331_10:46_1981-01-06,Roll_No:Time:Date,0,0
1984-10-04,Alexis Johnson,2022022,A-513,445778197,buy,14:59,Office method there authority.,2022022_14:59_1984-10-04,Roll_No:Time:Date,0,0
1987-06-12,Vanessa Sullivan,2020379,A-955,9714598329,focus,15:14,Though view arm nature recently eat commercial.,2020379_15:14_1987-06-12,Roll_No:Time:Date,0,0
2010-04-20,Timothy Bennett III,2021392,A-798,6794568564,age,15:21,Community build reveal president form education those send.,2021392_15:21_2010-04-20,Roll_No:Time:Date,0,0
1981-09-29,Willie Davis,2020954,A-353,199745632,contain,23:03,Memory other raise commercial.,2020954_23:03_1981-09-29,Roll_No:Time:Date,0,0
2008-04-07,Joseph Hamilton,2024727,A-817,5490380350,early,13:39,He issue baby common group home year.,2024727_13:39_2008-04-07,Roll_No:Time:Date,0,0
2011-06-20,Tyler Shaw,2024966,A-525,9014638486,say,05:29,Article win hope former wrong section ground.,2024966_05:29_2011-06-20,Roll_No:Time:Date,0,0
1983-12-08,Pamela Burch,2018267,A-801,5072685352,factor,04:12,Parent we development such wrong then red six.,2018267_04:12_1983-12-08,Roll_No:Time:Date,0,0
2013-03-11,Mary Ryan,2018655,A-411,3542707510,weight,00:28,Call section leader not key.,2018655_00:28_2013-03-11,Roll_No:Time:Date,0,0
1998-04-16,Rebecca Brown,2023076,A-805,9340776167,question,17:42,Rule occur bit compare fall.,2023076_17:42_1998-04-16,Roll_No:Time:Date,0,0
2012-04-22,Tammy Williams,2019481,A-277,5715219695,argue,13:44,System lay change source.,2019481_13:44_2012-04-22,Roll_No:Time:Date,0,0
2022-06-30,Daniel Wright,2021138,A-794,6437651435,money,20:18,Sign somebody least.,2021138_20:18_2022-06-30,Roll_No:Time:Date,0,0
1987-06-16,Michelle Underwood,2024900,A-833,1724825272,parent,05:18,Discover outside soon travel.,2024900_05:18_1987-06-16,Roll_No:Time:Date,0,0
2007-05-02,Robert Alexander,2018100,A-763,7823670856,range,11:10,Front federal message memory.,2018100_11:10_2007-05-02,Roll_No:Time:Date,0,0
2016-10-12,Leslie Chapman,2020333,A-106,3707567699,speech,22:20,Respond social human long consumer create.,2020333_22:20_2016-10-12,Roll_No:Time:Date,0,0
