Date,Name,Roll No,Room No,Contact,Equipment,Time,Remarks
1979-02-26,Kelly Mora,2021058,A-469,6817807077,effect,21:52,Election security contain ten.
1997-03-28,Mr. Eugene Estrada,2019063,A-181,4148425355,learn,09:24,Station myself take other.
1988-06-04,Carlos Reyes,2021095,A-428,7724967805,themselves,06:55,Meet on year benefit either above adult.
1988-11-17,Kathryn Martin,2021085,A-959,9420499,son,15:16,Happen attack add society.
1982-01-24,Claudia Terry,2023059,A-509,5989284661,another,19:45,Listen strong knowledge raise his.
1993-09-19,Adam Bradley,2022074,A-545,1730439239,threat,09:16,Walk study mission while relate.
1979-11-22,Debra Harper,2021088,A-526,2175010825,play,14:57,Anything contain there adult face edge much.
1980-04-02,Katherine Montoya,2022025,A-942,5863841537,agreement,02:43,Point central involve follow happen here four.
1983-07-12,Kelly Mora,2021058,A-298,6817807077,return,20:27,Very let more measure site best.
2020-08-22,Todd Archer,2023018,A-555,3709463999,general,09:17,Into consumer media little fill increase create.
1980-06-25,Nathan Carroll,2023033,A-775,7708320536,left,15:14,Item collection movement example necessary military.
1998-07-20,Joan Hudson,2021078,A-658,67488711,always,00:38,Situation think idea difference analysis sometimes.
1990-03-31,Todd Archer,2023018,A-156,3709463999,enter,06:02,Institution board fear.
1999-09-05,John Brewer,2021082,A-333,7428638452,often,00:44,See wall pressure because smile eight lay often.
2013-10-04,Todd Archer,2023018,A-471,3709463999,ball,13:04,Station cover college kitchen.
2003-10-04,Curtis Moran,2024040,A-668,6386814573,control,11:19,Across out appear.
1990-03-20,Stephanie Cabrera,2020079,A-298,654492244,believe,20:54,Phone nice weight agent.
2020-02-09,Jasmine Daugherty,2018019,A-308,1271144859,garden,01:16,Fact travel stock customer apply me class American.
1992-10-12,Claudia Terry,2023059,A-320,5989284661,star,15:31,Half top song board none stock low.
1999-10-23,Adam Bradley,2022074,A-21,1730439239,company,09:26,Benefit lawyer always respond store meeting box.
2016-07-20,Amy Bradshaw,2023021,A-595,1782986782,environmental,18:00,Even card stop fear change.
1994-02-08,Kenneth Blevins,2021071,A-970,1477999284,difficult,10:19,Less exist once your interest nice relate.
1980-02-28,Curtis Moran,2024040,A-452,6386814573,action,16:29,Poor finally discuss field we material rather.
2004-04-11,Michael James,2018005,A-496,9570619112,concern,18:38,Senior six into us fish.
1976-02-22,Jessica Perkins MD,2021047,A-170,1875363336,end,07:38,Different hot he too.
2014-10-20,Carrie Thomas,2018028,A-450,9414488797,check,08:32,Step face drug author would throw raise measure.
1971-09-13,Christopher Johnson,2024030,A-496,4907139048,walk,17:28,Court likely daughter end will standard enter.
2020-09-27,Jasmine Daugherty,2018019,A-181,1271144859,situation,08:31,Letter glass authority direction.
2012-08-07,Thomas Harris DDS,2018081,A-111,3307190698,glass,12:25,Her word something something.
1998-05-23,Bruce Haley,2019090,A-282,3333626697,next,11:53,Gas development tend.
1985-03-26,James Mcknight,2018029,A-43,6392777950,happy,16:33,Evening part create think.
2010-09-09,Donna Wilson,2022022,A-232,2993989350,that,18:12,Buy single read or staff executive.
1980-05-20,Joanne Ramirez MD,2019091,A-104,3468981670,yeah,00:43,Enough perhaps rather view drug.
2016-06-15,Jasmine Daugherty,2018019,A-73,1271144859,sister,19:15,Wide alone close religious onto speech whose.
1986-06-10,Tyrone Cooper,2020001,A-702,1330045459,girl,09:04,Lose yes couple specific news price executive.
2010-06-26,Shane Johnson,2018026,A-685,6109289458,remain,22:51,Generation first house type drop make night.
1975-09-23,Katherine Montoya,2022025,A-521,5863841537,left,08:11,Hotel machine serious time whatever fish.
1989-10-03,Lisa Diaz,2019043,A-54,3348511851,common,16:10,Public explain into building direction lot car traditional.
2008-06-01,Jaime Johnson,2023044,A-380,9637827807,hold,06:30,They bed quickly exist break vote lawyer most.
2006-08-23,Nathan Carroll,2023033,A-383,7708320536,whom,02:15,American thing indeed listen.
1978-09-09,Kayla Jones,2024062,A-91,986894779,answer,18:26,Structure already attack shake.
1995-03-14,Crystal Lopez,2022068,A-16,331990761,role,05:25,Record these couple resource.
1990-06-21,Kelly Mora,2021058,A-706,6817807077,consider,04:39,Plan Democrat interesting above increase page.
1996-05-14,Randall Ferguson,2020057,A-791,6590582758,scientist,18:54,Skin guy everything beyond nation beyond voice feeling.
1987-12-22,Erika Miller,2019077,A-674,7614186518,degree,10:03,Today less sing idea enter end cold.
1996-03-02,Lisa Lambert,2023076,A-976,9069073589,occur,19:03,Charge no people believe.
2002-10-23,Jessica Johnson,2023065,A-219,6572159559,population,19:05,However than state modern rest music difference.
1990-07-09,Joseph Lee,2019012,A-598,970309898,capital,23:14,Order child late.
1973-05-09,Melissa Weber,2022013,A-723,5645592214,skill,15:08,Race somebody still hundred.
1970-06-21,Jasmine Daugherty,2018019,A-611,1271144859,remember,00:19,Itself dog sister discuss single.
2009-02-24,Robert Conner,2022004,A-179,9893760754,sing,10:59,Education foreign pull politics rock.
2017-06-08,Jennifer Velasquez,2020008,A-879,4968430335,participant,05:28,Send we middle group.
1993-08-31,Robert Conner,2022004,A-914,9893760754,visit,20:47,Resource poor former bad political event enough.
2016-05-09,Alexandra Harrison,2019080,A-675,3978187240,behavior,05:06,Live game wish old game.
1977-04-06,Roberta Carter,2024009,A-608,2147685307,religious,04:54,Right political inside inside final face.
1972-02-16,Mrs. Martha Meyer,2023002,A-247,7785712237,kid,20:32,Recognize despite knowledge production international southern carry.
2006-12-22,Gina Bryant DDS,2018024,A-624,9313732653,easy,07:58,Recent history always until country character ready.
2017-05-12,Thomas Harris DDS,2018081,A-902,3307190698,his,16:01,Everything end fight can wonder force.
2000-11-18,Jennifer Velasquez,2020008,A-660,4968430335,size,07:35,Hot difference land ball goal memory live.
2017-05-21,Garrett Burton,2018089,A-102,3614665364,wait,14:27,Show current crime old fund blood option may.
1975-03-04,Debra Harper,2021088,A-757,2175010825,air,21:00,Song describe network voice run way form network.
1999-11-11,Benjamin Walker,2020034,A-138,3026835385,recently,17:53,Phone keep every wind.
2001-03-20,Richard Hunt,2022075,A-860,2625256681,wonder,02:24,Cover investment seat Congress.
1976-09-11,Adam Bradley,2022074,A-668,1730439239,stand,18:07,Surface quite election conference me continue receive.
2019-11-24,Dr. Amber Garrett,2021053,A-959,8083968586,live,05:07,Structure financial successful interesting.
1977-07-04,Michael Williams,2023048,A-273,4254452672,either,14:54,Seem along order set field learn.
2003-01-19,Dennis Graham,2020054,A-919,631640363,near,05:58,Organization from measure from whole most identify.
1994-07-17,Donna Wilson,2022022,A-638,2993989350,visit,16:42,Change part voice him specific central.
2002-03-31,Mrs. Martha Meyer,2023002,A-525,7785712237,determine,16:14,Live whole fact generation.
1991-03-09,Adam Carroll,2021042,A-332,7433089354,organization,20:23,Today think computer husband eight base even.
2006-04-05,Eric Houston,2023017,A-526,1454271514,official,15:38,Trouble prove reduce exactly decide.
1973-12-13,Tyrone Cooper,2020001,A-504,1330045459,score,19:00,Force well argue give drop.
1998-07-17,Jaime Johnson,2023044,A-519,9637827807,later,21:31,Entire computer employee beat beautiful describe.
1991-03-31,Todd Archer,2023018,A-279,3709463999,they,11:43,Able door drive share.
1992-02-09,Jessica Perkins MD,2021047,A-902,1875363336,nothing,04:15,Activity attack paper course foreign close plant.
1983-05-10,Reginald Silva,2021093,A-432,2160101171,cause,04:02,Impact final how five add operation easy ability.
1988-11-30,Dennis Graham,2020054,A-186,631640363,any,10:44,Four community again whom education.
2023-03-19,Eric Houston,2023017,A-234,1454271514,force,04:51,Meeting safe west hear avoid do school.
1994-09-19,Adam Bradley,2022074,A-521,1730439239,who,14:20,Believe remain success answer task.
1972-05-30,Christopher Johnson,2024030,A-803,4907139048,far,03:47,Information miss drive fish direction.
2002-02-24,Jessica Hunter,2021020,A-1,7375443865,national,05:39,Some action open edge.
1999-06-29,Christina Rojas,2022064,A-72,2608367057,consumer,22:10,Test financial ground economy four training push.
2023-03-29,Brian Wise,2019003,A-669,5437500399,lead,09:13,Reveal return allow seek.
1972-02-21,Lisa Diaz,2019043,A-481,3348511851,own,16:08,Economy evidence visit say people.
1988-04-07,Mario Lambert,2023070,A-919,5595619747,similar,03:25,Suffer happy officer mouth inside.
2000-11-15,Lisa Gibson,2020086,A-456,6115755102,chance,22:03,Coach others avoid change.
1989-02-16,Victoria Woods,2023041,A-429,2938958152,particular,19:50,Near station after care.
2005-02-24,Teresa Butler,2022050,A-579,4033504082,analysis,10:02,Professor image order act.
2008-12-04,Amy Norton,2018083,A-202,86606964,authority,07:03,Dark government and.
2007-06-02,Jennifer Chambers,2020039,A-992,5512763532,per,00:41,While our could rise.
2007-10-23,Jennifer Miller,2022038,A-6,6099999676,phone,02:16,Anyone result man two surface central.
1975-09-08,Lauren Simpson,2024016,A-850,4382663586,history,22:34,Girl poor already indicate clearly alone.
2021-02-28,Michael Coffey,2022031,A-391,9151938495,ball,07:02,Offer serve media camera teach area.
1993-12-04,Shane Johnson,2018026,A-978,6109289458,order,09:30,Western say walk not.
2017-03-24,Lisa Nguyen,2019032,A-752,5489159342,ask,20:14,Less head when recognize per.
2011-12-21,Lisa Gibson,2020086,A-641,6115755102,physical,06:18,Western reality why wish claim.
2003-05-11,Victoria Woods,2023041,A-420,2938958152,bed,20:40,Leg season deal threat account.
1986-05-14,Teresa Butler,2022050,A-403,4033504082,act,08:05,Task road include maybe education huge.
2003-03-01,Mr. Eugene Estrada,2019063,A-211,4148425355,campaign,04:10,Up event bed something cut sit clear.
2015-11-14,Kayla Jones,2024062,A-354,986894779,whatever,10:23,Hundred your consider more popular side.
