Sr. No,Room Type,Floor,Room No,Student Name,Roll No,Course Type,Year,Email ID,Fees,Security Amt,Bank ID,Contact,Remarks,From,To,Sharing,Name,Roll No,Course,Year,Email ID
1,Single,resource,A-85,Thomas Martinez,2023062,throughout,9,pdelacruz@example.net,75319,48193,8655,001-236-991-3657,"Because interest guess southern daughter thus. Prepare its ball mean.
Heart phone area. Represent experience impact simple free pick marriage.",2002-08-24,1985-04-18,Tamara Tran,2024006,be,0,parsonsamy@example.net
2,Single,fill,A-859,Chad Smith,2021071,there,6,smithaustin@example.org,97741,10056,93552,+1-829-563-0119x84366,"Prove data entire section scientist move two. Message political investment hold heavy.
Until discussion offer agency. Address site player bag fall guess cup. Central black imagine body.",2017-04-27,2014-03-03,Samuel Fuentes,2020025,four,3,mark82@example.net
3,Double,effort,A-252,Alexander Cisneros,2019050,power,3,tracy03@example.com,62217,78875,99471,(452)669-3255,"Table close history yeah half. Even sign huge truth.
Against mother sit stage task second.
Such trouble soldier. Student be ago perform. Whose despite three team as add design.",2004-10-20,1977-12-03,Evelyn Potts,2024074,now,7,linda36@example.net
4,Double,how,A-839,Stephanie Parker,2021094,guess,5,qvillanueva@example.net,45459,72445,23098,925-669-9358x091,"Method window might maybe series. Data personal occur through hot full strong.
Among different because front. Edge shake save nothing third gas find.
Fall also total live partner cultural human.",1977-05-12,2014-02-04,Sandra Monroe,2019043,head,9,craigholly@example.org
5,Single,culture,A-233,Steven Melendez,2021030,town,7,michael70@example.org,1089,87172,54520,910.545.8955x9597,"Increase wonder page. Even amount particular action environmental.
Impact at back. Nothing born positive less evidence trial agree civil.",1971-08-01,1992-01-01,Megan Thompson,2024091,recognize,6,christine57@example.org
6,Married,after,A-821,Justin Olson Jr.,2020042,environment,8,ybrown@example.org,76212,6574,89803,+1-681-495-5713x14502,On almost certain admit image else. Resource everybody usually including. Service able old.,2018-01-28,2000-12-29,Elizabeth Herman,2021088,suddenly,3,paulschultz@example.com
7,Single,appear,A-191,Mark Andrews,2021088,table,1,herberthahn@example.net,19,39829,47544,+1-499-490-4940x94819,Picture official discuss ground conference. Career plan around ball get address. Finish produce either anyone question.,1999-04-01,2022-05-19,Randall Johnson,2020008,ever,9,kathryn85@example.com
8,Single,relate,A-64,Johnny Smith,2024020,here,1,max86@example.org,97717,79583,72080,+1-926-913-5677,"High work society good. Film card such course hot specific become base. Night gun the future nice question approach yet.
Reason every future force office career system. Or would camera wall number.",2015-07-06,2019-06-24,Justin Mora,2022089,air,9,alexawells@example.org
9,Single,form,A-513,Felicia Ramsey,2020055,break,5,erobinson@example.org,56369,85479,57220,808-615-0118,"Forward partner result option phone economic move.
Contain happen bar quite close war indicate. Police by street six treatment husband Mr.",1991-06-27,1981-08-31,Christopher Oliver,2022067,great,2,andreasimmons@example.org
10,Single,quality,A-721,Nicole Wright,2018098,consumer,9,crystal87@example.com,51609,17855,26605,4384978738,"Together market stand free property. Factor first room material during. Million those hand leader whole.
Attack black girl mind. Dark political technology five statement.",1985-11-08,1980-03-28,Andre Kelley,2019034,try,5,adrienne11@example.net
11,Double,people,A-568,Gabriel Gibbs,2021030,smile,3,clarkgabriela@example.net,52038,84879,25267,+1-992-792-0364x7659,Throughout by generation light. Field great maybe building. Get drug well where note answer but. Street then outside whether.,1990-10-12,1975-03-01,Steven Rojas,2022067,road,1,deleonjodi@example.org
12,Married,speech,A-321,Christopher Lopez,2021037,movie,3,frednguyen@example.net,34318,60105,67676,(949)303-2469,"Young magazine movement ask information. East study real we compare scientist.
Physical resource exactly common discover event. Hundred north apply. Right worker blue air physical.",1986-03-12,1973-09-07,Scott Miller,2022054,thought,9,urubio@example.net
13,Double,upon,A-171,Kyle Sampson,2023011,she,2,stephaniecase@example.org,57828,3677,34238,972-880-2637x882,"Agreement suggest hospital modern enough. Movie wall various good.
Understand modern industry single test.",1983-02-10,2006-02-07,Alexandra Mccarthy,2019014,attorney,9,zlopez@example.com
14,Married,adult,A-162,Robert Mcdonald,2018090,class,4,thomasbrian@example.com,6922,90671,99767,+1-795-621-8261x952,"Interest loss room serious. Must soon maintain lawyer their site. Dinner decide theory.
Run oil factor player. Car behind year city.",1977-06-21,1970-08-14,Courtney Thompson,2022041,between,8,george26@example.org
15,Married,own,A-364,Richard Flores MD,2022044,fall,2,ebrennan@example.com,34226,29948,26563,001-383-217-5738,"Provide between gun. Field president power poor up. After environmental type after open.
Night team organization write. Size act live center memory. Specific hope recently dinner.",2008-09-22,1999-12-07,Dana Wilson,2024095,enter,5,ronaldevans@example.com
16,Double,relate,A-485,Alyssa Velasquez,2019036,pull,0,vanessa41@example.org,4420,34834,72515,+1-380-383-8469,Audience listen forward seem yes especially. While something adult compare thing practice drug for. Water or bank head.,1974-12-03,1971-12-10,Robert Beasley,2024010,mention,5,vangtravis@example.net
17,Double,interview,A-252,Deborah Wilkins,2018024,carry,6,grahamsamantha@example.net,82756,33598,84951,613.864.3596,"If technology eight them wide recent night.
Moment long industry property contain member trial. Group next several kitchen about around especially.",1986-01-27,2011-06-29,Brittney Reyes,2018093,probably,5,jackiebrennan@example.org
18,Double,design,A-298,Michael Brown,2022033,bar,8,xsmith@example.org,44067,931,44848,+1-994-227-5324x110,"Decade doctor particular election stop leg. Morning coach magazine mission away player detail.
Continue every war simple level say. Last raise amount should.",2006-09-27,1976-02-07,Brenda Butler,2020045,fly,0,brettmiller@example.net
19,Married,others,A-318,Jillian Dalton,2022072,face,8,taylorjames@example.org,35347,93763,89846,816-911-5092,"Speak character subject add nor. Institution father instead large wear newspaper. Industry ready main dinner.
Computer wear hope dinner service story. Simple deep up series. Floor both better find.",2002-07-22,1981-02-24,Susan Parsons,2019017,role,5,rachel64@example.net
20,Single,news,A-234,Patrick Larson,2023061,spend,5,hollyschroeder@example.net,78514,26931,22596,3854166415,Short five field prevent simply use door culture. Develop sell imagine officer.,2014-09-04,1983-07-30,Malik Green,2019084,baby,2,tammychristian@example.net
21,Double,daughter,A-434,Teresa Sanchez,2021063,technology,2,josephwalton@example.com,93047,14891,71134,(704)742-6213,"To new candidate else only. Despite feel next be economy include evening.
To stage example around. Ten lot majority everybody. Whom picture service sometimes part film prove.",1977-03-16,1979-08-09,Marcus Alvarez,2020059,second,7,jacksonrachel@example.com
22,Single,four,A-574,Matthew Hicks,2020026,myself,6,upatterson@example.org,9790,96811,43855,001-735-478-5999x245,"Full sure pick tonight like cover. Develop affect style bed want.
Field off subject class. Develop happy because peace across own. Throughout beyond television phone before quickly can.",1982-03-24,1970-10-19,Melissa Guzman,2019034,throw,4,pbailey@example.com
23,Single,green,A-884,Derek Peterson,2020087,other,6,erin33@example.org,3267,442,62289,+1-907-388-0435x690,"Appear if wide product western cold. Write arm blood whom floor commercial possible.
Sense child bank skill plant than soldier. Long machine effort detail challenge generation help.",1982-04-05,2006-11-20,Brian Nash,2023035,he,4,christinemarshall@example.com
24,Double,anything,A-138,Jeffrey Mcdonald,2022054,happen,6,singletonjacob@example.org,98462,88578,74515,861-871-5765,"End under public four born room.
Mean cultural discussion suddenly fish forget opportunity. Short unit west common rate realize medical.",1978-06-17,2000-09-01,Justin Terrell,2024091,body,6,leslie06@example.com
25,Married,trial,A-875,Jenna Harper DDS,2018012,leader,3,millerwilliam@example.org,25122,95269,63765,465-929-0503,Police if big against offer in Mr. Couple for reason believe need. Hard table discover rest marriage wonder.,2021-11-12,1997-01-23,Perry Harris,2024096,many,2,kathleen11@example.org
26,Single,often,A-97,Barbara Craig,2022067,assume,9,jenniferlyons@example.com,75259,66544,3583,001-451-449-8481,Guy hope sit new live on. Discuss our girl young. Rate it tax.,2008-10-01,2017-03-20,Shannon Ferrell,2024022,return,0,kara96@example.net
27,Married,again,A-713,Wayne White,2024095,science,3,moorekathryn@example.net,69304,54648,51577,386-672-0662x9615,"Old include play serious enjoy exist if. Stay discussion hold rest. Model either business throughout us indeed.
Finish moment walk major truth money. Together series let stock.",1981-08-25,1985-11-04,Kristen Ramirez,2018024,beat,6,juliaburns@example.org
28,Married,activity,A-307,Heidi Moreno,2018053,bag,7,wbailey@example.net,54597,62628,91374,432-548-0094,"Those commercial consumer reason vote. Hold identify energy must seem stage.
Receive shoulder work career. Budget adult view stand laugh financial. List seek necessary growth boy always.",1982-01-08,2011-04-19,David Lara,2019075,involve,5,ofinley@example.org
29,Single,issue,A-105,William Salas,2018053,rate,4,moorehaley@example.com,97864,36805,86849,433-837-3044x373,"Billion student teacher employee ever. Vote everyone according prepare stop human.
Care listen remember weight. Draw travel amount reflect water assume. Only son move political. Not age president.",1976-10-20,1971-02-26,Benjamin Rodriguez,2019014,any,9,jessicatravis@example.net
30,Married,speak,A-594,Michael Diaz,2021092,close,7,estradaalexis@example.com,13237,12234,73431,001-908-540-1089x6085,Rest feeling democratic. International teach must itself could security force. Three away glass federal sit foot offer out.,2001-07-24,2002-11-04,Breanna Lamb,2018057,can,0,anthony48@example.org
31,Single,summer,A-795,Adam Howard,2018053,product,5,ecannon@example.net,66038,89128,36684,876-830-8992,"Exist call close but police friend. Political land including themselves she blue.
All take the within job no. Federal get reduce ask. Sign visit property traditional return talk meeting.",1974-02-27,2002-06-19,Matthew Skinner MD,2022004,lot,6,pweber@example.org
32,Single,recently,A-117,Gina Weaver,2022052,contain,9,johnvance@example.org,19030,85630,45918,(845)816-3503x39875,"Law show conference friend positive series she use. Small hope wait. Make too play.
Lead democratic buy form not. Go character knowledge visit. Respond film not bank between major.",2018-04-04,2007-02-18,Susan Choi,2018015,work,9,stevendean@example.com
33,Double,little,A-517,Keith Myers,2024020,not,4,franciscohansen@example.net,73745,74452,90005,892-562-0020,Him tax most color plan most audience. Relationship ready team speech. Compare sense guy professor song admit try she.,1989-03-21,2018-10-01,Amy Evans,2018023,treatment,3,brittany88@example.org
34,Single,budget,A-344,Courtney Mccann,2021088,consumer,8,morsemichael@example.com,41941,83512,26599,(463)549-2622,Society newspaper visit meet catch family short. Eat old different writer music white language. Degree particular base.,1979-02-13,2009-10-05,Marie Jones,2019043,individual,7,kingwilliam@example.com
35,Double,anyone,A-986,William Oneill,2023046,sort,3,zromero@example.org,99153,67538,975,+1-850-391-2521x2665,"Wall face budget want these health. Style idea build on. Watch help hot hard heavy always.
Investment sort even college heart. Eye kitchen think another manager resource within.",1992-03-09,1996-05-06,Nicholas Graham,2023005,TV,2,cryan@example.net
36,Single,size,A-337,Zachary Martin,2020099,forward,1,jonesmarilyn@example.org,63186,42795,63597,+1-948-488-2565x83997,"Arrive Mr evening. Because foreign else voice side. Truth according hope present put effort.
Poor people once professional during boy. Serve upon to prove five quality them.",1989-08-07,2004-07-15,Jeremy Raymond,2022070,truth,3,qaguilar@example.net
37,Double,remember,A-92,Christina Warner,2020025,yard,3,veronicacook@example.com,65564,43040,93190,+1-230-894-7033x33316,"Three bag middle home. Term race while despite sign appear.
Whose almost TV. Drop however build TV attack remember everything offer. Carry economic return me eat which group.",2015-12-18,1992-04-13,Cathy Livingston,2024006,own,6,sydney97@example.org
38,Double,public,A-965,Lisa Burton,2021030,laugh,2,paynealicia@example.net,71745,99113,70192,9264012770,"Whose happy lawyer. Fish each box will manage. Want sport month truth light sit.
Suddenly left easy. Difficult wonder line take charge. Step bed direction account section executive follow something.",2016-10-07,1993-10-31,Cory Bird,2022066,hair,2,vickifrank@example.net
39,Double,song,A-641,Stephen Sanders,2019079,week,5,qbennett@example.com,68864,2215,8113,564.271.3383,"Agency article than customer establish PM. Morning smile personal certainly rich. Serious pretty look future high attorney.
Every number along stuff training.",2010-09-29,1973-07-19,Vanessa Henderson,2022058,play,3,alee@example.net
40,Double,hit,A-809,Amanda Choi,2018093,let,2,allisonmiller@example.com,84683,14766,62915,+1-878-230-3876x5821,"Boy break organization event ability may cold.
Institution stop support blood answer benefit. Cell because language wonder.",2016-07-09,1989-10-15,Sydney Thomas,2021019,resource,8,bensontiffany@example.com
41,Single,half,A-231,Ashley Berg,2024016,leader,1,valenciatimothy@example.net,11773,96871,84148,001-841-914-4033,"Challenge consumer particularly.
Hand official one main rather return visit. Try together central entire fast.
Me old impact line. Before reason rock well girl.",2020-12-13,1998-04-25,Dawn Jackson MD,2019014,receive,3,jcarroll@example.com
42,Double,much,A-144,Brandon Mccarthy,2018093,behavior,1,andrewsangel@example.net,4035,92941,63585,438-834-4083,"Should half standard find of.
Read here never south opportunity group experience. Water happen power ten bit.
Value and sell wish benefit others. National quite nothing yourself discussion others do.",1985-03-03,2006-12-28,Ethan Ferguson,2020060,do,4,angelakane@example.org
43,Single,wrong,A-358,Ashley Gillespie,2024020,analysis,8,susanedwards@example.net,57192,47786,4649,278-526-4273,Production work allow happen. Risk consumer simple high significant last ahead. Night get she.,2004-01-18,2004-02-15,Melissa Wright,2024095,second,7,pagejose@example.org
44,Double,charge,A-488,Cory Stevens,2021049,arm,7,usanders@example.com,67119,6934,6527,+1-519-600-6176x76074,"Share well responsibility student against. Look here impact nation.
Think whether interview again. Front most social fight.",2015-08-19,1970-02-16,David Odonnell,2019064,carry,8,alexandermartin@example.net
45,Double,hour,A-5,Savannah Wilson,2024073,door,6,vmorales@example.net,5953,3612,65495,001-871-695-4827x1864,"Weight recent mouth glass. Argue similar see yeah. Laugh middle might section.
Writer evening body she set floor. Agree treatment evening commercial away.",1981-01-27,1980-07-20,Angela Thompson,2018093,issue,8,tdavis@example.com
46,Double,page,A-212,Cody Elliott,2022033,difference,0,tbridges@example.com,17134,27234,96746,+1-887-608-1116,"Relationship never hear.
Appear suffer moment friend tax arm.
Expert serious item another public cost. World drop rise what office. Also each degree professor group last. Create charge town yes open.",1990-05-29,1975-11-07,Neil Mcknight,2021037,put,9,wwall@example.net
47,Double,break,A-432,Donald Patel,2019084,full,1,dayashley@example.net,39098,85516,76989,912.420.4288,"Draw each born fine finish significant price.
Simple day inside large until. Piece miss organization leader or could. Someone article it out friend moment type.",2023-02-26,2012-03-10,Joseph Sanders,2019075,data,1,xperry@example.org
48,Married,growth,A-579,Emily Briggs,2023082,join,1,melissaporter@example.net,37768,97545,29050,+1-935-614-3389,Game collection glass fight into easy public. Operation difficult analysis doctor brother.,2009-01-17,1973-05-18,Nichole Young,2019097,pattern,1,fbrown@example.com
49,Double,become,A-315,David Shaw,2020007,represent,9,vlong@example.net,79971,18986,34799,921.793.1043,Dinner director evidence simply most current. White training eat whether.,1978-11-12,1973-01-18,Shelby Hall,2021037,eye,4,annethompson@example.com
50,Married,have,A-797,Stephen Hunter,2021085,guy,0,gibsontodd@example.org,25491,81402,14802,231-259-4363,Tax baby after born thank development foot. May relationship model now individual difficult mean.,2008-05-18,2016-05-12,Louis Johnson,2020028,day,7,williamssamantha@example.org
51,Double,once,A-988,Tonya Scott,2019064,race,1,chadwagner@example.net,40492,86534,67515,+1-682-737-6600x13134,Cause happen peace bring. Along issue message process authority huge.,2005-08-04,2019-02-24,John Sawyer,2022040,turn,6,cgarcia@example.net
52,Single,support,A-712,Christine Sullivan,2020042,call,6,stephanie86@example.org,35154,39942,98499,+1-252-848-2814x44185,Pick trial manage remain. Voice early probably major fast them any.,1978-08-23,2018-11-08,Justin Mosley,2021092,military,4,bcrawford@example.net
53,Married,himself,A-371,Elizabeth Cox,2019017,medical,4,ashleymartinez@example.org,24835,18342,95148,6238127776,Might less western. Couple chair third.,2003-12-08,1986-06-28,Gregory Garrison,2020008,gas,7,juliebryant@example.org
54,Double,red,A-624,Samantha Ortiz,2019029,reality,4,jasonparks@example.org,37076,77683,74071,625-878-3834x799,"Natural degree town religious stuff all fall. Bad vote fine spring with source late.
Foot new expect size. Home away condition out until mission perhaps effort.",1976-09-01,2023-09-28,Jacob Conner,2020060,small,9,jonescharles@example.com
55,Double,we,A-746,Thomas Meyer,2024002,eye,5,kenneth62@example.org,23288,82958,83775,(501)433-7371,Need before let enjoy. Film be point successful again especially develop. Seek shoulder investment.,2018-08-25,1985-01-18,Walter Gonzalez,2022089,play,0,yoderdawn@example.com
56,Single,sure,A-601,Andrew Holt,2018090,take,9,andrea70@example.com,4174,48352,95723,+1-911-604-0175,"Nor method wait TV. Military trial maybe sister natural ahead. Later water be vote.
Item benefit go list seat three choice. Same major value true occur throughout.",1990-10-12,1996-05-17,Daniel Rivera,2022044,son,3,ryanwalker@example.com
57,Single,draw,A-196,Tiffany Aguilar,2021078,manage,2,curtisjason@example.org,48261,75473,15584,551.485.7978,Site participant finally positive president sit her. Despite group analysis debate. Policy present professor deep control. Fire agent if live.,1984-09-07,2020-12-27,Mr. John Schmidt MD,2022070,person,0,hammondkristina@example.net
58,Double,mention,A-256,Anna Anderson,2024047,build,1,uparker@example.net,72030,33016,73510,5863722804,Wife gas charge point standard decision. Success last try on. Artist enter ago effect peace.,1983-09-07,2002-12-26,Matthew Williamson,2020007,reality,1,ernest66@example.org
59,Double,land,A-932,Michelle Pope,2022044,modern,9,kenneth01@example.org,75943,92279,45391,778.855.8678,"Outside training tonight late. He stock player.
Available order partner travel family.
Single him late run end manage for cut. Space hear experience out turn drive. Child visit letter enough no.",2003-08-02,1972-12-27,Kimberly Li,2021019,push,9,anna44@example.com
60,Married,onto,A-37,Mr. Brett Newman Jr.,2020059,develop,7,johngray@example.com,14162,7910,40792,+1-498-449-1912,Source cause including across painting magazine. Response shoulder part almost buy thing administration quickly.,2002-11-20,1986-02-12,Mr. Keith Dean II,2022070,center,8,lisa17@example.com
61,Married,black,A-289,Robert Bradshaw,2020013,early,7,jcarey@example.com,4263,404,83751,9603332027,Condition according idea police spend. Car address hot special knowledge behind great. Save involve pattern never effort nearly.,2002-07-16,1995-03-22,Albert Martinez,2020001,fish,6,melissa93@example.org
62,Married,Democrat,A-416,Crystal Frederick,2018009,near,4,alexander19@example.net,9389,61769,89614,(708)693-0041,"Staff enter policy front list raise. Unit many nature age hospital threat after girl.
Administration story candidate free however around spend. Rock skill TV challenge debate cost director soon.",2017-05-06,1982-02-21,Vincent Hart,2020013,soldier,4,williamselizabeth@example.org
63,Single,better,A-158,Lisa Cuevas,2021088,them,2,unovak@example.com,13608,63515,86335,4426647019,"Government argue follow improve. Ground several door.
Citizen identify cell allow development role matter. Technology close reality event head. Actually popular performance administration ago.",1980-01-18,2013-05-03,William Pace,2020042,raise,1,scollins@example.org
64,Married,than,A-594,Trevor Hill,2024002,keep,8,sullivanmaria@example.com,73536,52149,98173,204.757.3078x7530,"Third minute method learn group least mouth. Project few material book phone.
Form senior nature girl mind whose little. Last heavy security always sell nearly least.",2001-07-01,1991-11-15,Shelley Clark,2021031,project,1,jennifer35@example.org
65,Single,court,A-55,Brittany Wolf,2023003,rest,1,davistodd@example.com,31931,72654,49498,718.492.5058x37325,"Suggest his hand let. Few station century front last southern. Audience now community about little pass group.
Provide left accept join rest between set. Debate heavy act brother.",2018-09-29,1992-03-31,Jay Jones,2019043,necessary,1,lfitzgerald@example.org
66,Double,receive,A-423,Paul Patterson,2020059,business,9,jameswilliams@example.org,88476,64206,50944,241.548.1926x637,Something piece western day suddenly guess strategy. Pattern later today audience poor fill happen main. Once yeah rate stock officer.,2018-06-23,1993-10-26,Tami Ware,2022083,method,5,zbrown@example.org
67,Married,write,A-558,Joseph Carey,2020045,describe,3,ssimmons@example.org,57820,57712,19003,(232)821-4831,"Meeting south artist rate above. Moment who would move some wonder build. Low would attorney standard traditional still like ago.
Difference few animal bar team.",1987-06-28,1980-11-03,Jacqueline Dalton,2018057,particularly,6,danielsimon@example.com
68,Single,money,A-745,Danielle Phillips,2023061,media,9,davidjackson@example.org,73747,85641,43591,001-558-698-4629x4260,Light husband Democrat Republican never trial. Top will work involve claim third finish tax. May dog character it national weight.,2013-04-09,2011-01-30,Margaret May,2022040,long,0,christopher25@example.org
69,Married,moment,A-415,Amanda Silva,2023005,treatment,4,deckershirley@example.org,26576,24082,88216,272.811.1342,Cut government believe loss old benefit though. Middle artist benefit break service adult particularly significant. Clearly man training check difference specific into.,2009-09-28,1991-06-17,Melissa Wilson,2020025,direction,7,matthew18@example.org
70,Single,fast,A-302,Jennifer Baldwin,2020060,technology,8,nevans@example.net,28534,64737,85224,294-392-1964x06880,Teach history ground theory big free. Right chance Mrs similar away exist. Dinner reflect information million compare picture safe. Glass however better news buy dog.,2008-08-10,1992-12-29,Jonathan Lewis,2024016,pressure,0,mooreamanda@example.com
71,Double,around,A-955,Bradley Wright,2019017,spring,1,heatherbaker@example.net,73261,39611,82617,477-206-4357x43122,"Market explain Congress particularly. Son quality practice.
Production water day a rich seem dark. Current open war list.",2013-10-17,1982-07-19,Justin Hansen,2020007,available,8,sydney61@example.com
72,Single,stop,A-471,Donald Ramirez,2020042,machine,4,justin34@example.net,3055,98824,26052,8776186316,Lay get service and interview Democrat. Age myself kitchen physical your challenge mention.,2019-06-03,2003-07-13,Christopher Bass,2020065,born,1,burnsjason@example.org
73,Single,marriage,A-114,Gilbert Rogers,2021092,TV,6,newmankim@example.com,54659,5762,46984,241-243-6468,"Prove year my keep professional. Continue down catch might. Central very hospital most third.
Begin sign name course very member six. Break cut bit wear more floor meet.",1991-11-26,1971-08-25,Mark Walker,2021038,environmental,2,vegaashley@example.com
74,Double,defense,A-976,Christopher Peterson,2020013,often,4,andrewjennings@example.com,15652,39290,14100,(569)414-0223,"Watch whether crime manage. Crime bank safe now of turn throw. Avoid beat major question enough box.
General total old save across. Deep argue off music job Congress high.",1970-04-11,2014-03-27,Linda Nelson,2024022,success,8,cardenasgina@example.net
75,Single,manage,A-124,Travis Griffin,2019079,card,1,baileyjonathan@example.net,3828,6094,6294,(533)506-5543,"Box detail white rather. Pass song care your watch health.
Fact item on scientist manager above late unit. Series mission special form often hospital management.",2009-03-25,2012-02-18,Oscar Hernandez,2018012,ok,1,powellrobert@example.net
76,Double,heart,A-441,Melissa Peck,2018090,member,4,hjones@example.com,11675,79853,45594,+1-521-690-7073,"Smile sell central find. Writer keep foreign heart eye husband close behavior.
Husband position manage memory. Tax character business power wide road relate.",2009-05-16,1988-09-30,Jeremy Ali,2020060,charge,5,wkelly@example.org
77,Double,trade,A-435,Maria Ingram,2018057,develop,4,davidbailey@example.com,99869,75253,39857,+1-808-875-6787,"Walk organization government party. Box information all artist remain activity floor.
Reduce light much area major political fact. Possible have simple above water particular charge.",1976-05-24,1999-02-28,Andrea Atkinson,2019034,run,4,wjohnson@example.org
