Sr. No,Room Type,Floor,Room No,Student Name,Roll No,Course Type,Year,Email ID,Fees,Security Amt,Bank ID,Contact,Remarks,From,To,Sharing,Name,Roll No,Course,Year,Email ID
78,Single,human,A-199,David Bell,2022077,audience,9,rphillips@example.org,81278,45470,951,800-913-4152,"Maybe gas foot agree. Begin house tax brother. Final about always operation interview where. Affect technology police must own stop great.
So western gas tax at not.",2020-04-15,2005-02-26,Rachel Raymond,2020013,yard,5,landerson@example.com
79,Single,social,A-299,Matthew Jimenez,2022040,part,0,michael78@example.net,91917,10770,68258,222-375-1730,"Receive finish leave then room international standard. Position enjoy choice reduce sing recently.
Ago decide official thought remember. Support bill through.",1984-08-15,1987-05-09,Justin Key,2018009,college,3,robertsonkevin@example.com
80,Married,gun,A-231,Nicole Fitzgerald,2021076,yet,8,jamescunningham@example.com,96686,43144,79863,(612)278-0419x161,"Capital stand southern key consumer when. Or radio though.
Yard senior hope say control. General present plant rate bring few.",1995-07-16,1986-03-13,Jennifer Nielsen MD,2023035,daughter,3,dustin72@example.org
81,Single,prepare,A-324,Anna Anderson,2024068,owner,7,claudia39@example.org,68152,63047,40776,774.994.0027,"Most class seven very off medical dog listen.
Yet keep war prove page. Pass office board rich the. My onto until night run yet maintain.",2008-06-06,1991-07-25,Cody Banks,2018053,phone,6,kristin55@example.org
82,Double,buy,A-712,David Murray,2022077,road,7,virginia65@example.net,99851,428,29081,001-883-559-4885x56491,Level gun his want stand break capital. Lot direction play more conference mention. Than so fight per throughout speech action line.,1998-04-12,1993-01-10,Patrick Strickland,2022066,very,2,oenglish@example.com
83,Married,doctor,A-59,Peter Joseph,2022072,moment,9,vperez@example.org,26790,68716,38560,590.398.3815,Lead less lay her. Theory director attorney decide name guess. All alone show majority traditional agree determine.,2018-05-08,1992-02-19,Sandra Russell,2024016,song,0,ehowe@example.org
84,Double,single,A-32,Jennifer Guerra,2022089,miss,6,colemancaitlin@example.com,84640,33917,89302,(968)422-7580x838,"Group risk even may. Sister member read expect recently partner health. Tend feeling nature light.
Law walk test financial against. First dream least law skill PM carry.",1992-08-28,1971-11-02,Sandra Jones,2018093,year,6,atkinsbenjamin@example.com
85,Single,charge,A-77,Megan Moyer,2020087,town,6,foleyjill@example.org,51335,52708,62797,380.786.1648x301,"Story physical few teacher half ground voice. Idea people impact concern store exactly.
She find various base every figure sign. Loss mother themselves movement there experience.",2012-02-05,2007-02-23,Stacey Lynn,2022054,smile,9,knunez@example.org
86,Double,represent,A-163,Debbie Barker,2024016,defense,7,jill52@example.net,10923,66526,4324,6949405440,Remain debate administration agree development describe. Course dream possible hear strategy expect. Strong individual leader cut accept.,1976-12-26,1992-08-31,Dr. Jane Mitchell,2022083,friend,3,natasha98@example.net
87,Single,sell,A-428,Patrick Mills,2021092,popular,7,joanne47@example.net,40078,84949,11502,001-782-617-5015,"Similar see late plan. Hour whatever every either area bit. Will call whom lead able.
Goal heavy those possible ok admit.",2002-09-27,1983-09-07,Kimberly Merritt,2020001,people,5,angela74@example.net
88,Double,Democrat,A-159,Raymond Cox,2018009,one,5,ellen14@example.net,21929,4663,31236,769-627-0561,Push data tonight might base economy. At goal right official way specific foreign example. Laugh positive education within herself.,2011-04-05,1977-05-31,Johnny Brown,2023046,common,5,osbornelizabeth@example.org
89,Married,success,A-774,Ian Armstrong,2024010,upon,1,thompsonstacy@example.org,45106,76943,14859,274.903.6482x6950,Seven design yes full. Prove police star north bit particularly necessary. Agent specific because price make.,1982-07-23,2017-05-11,Lindsay Smith,2019084,set,3,johnblack@example.com
90,Single,first,A-258,Jamie Robinson,2021038,blue,2,christina52@example.net,11772,78361,90296,(318)374-0989x719,"Address training prepare majority right inside yet. Hour add chance line my.
Any focus smile upon check. Minute mention movement man religious cup account.",1996-08-26,1972-09-05,Thomas Fitzgerald,2023046,campaign,3,nicole15@example.org
91,Married,prepare,A-600,Dylan Wilson,2022077,compare,0,william60@example.net,6839,6579,39055,(422)213-7809,"Alone official bed right charge. Meeting me Democrat animal.
Technology child factor. Table same fund although Mr view father. Before decision measure now company without party prevent.",2008-09-07,2002-12-14,Joy Padilla,2020055,offer,4,scottmichele@example.net
92,Double,show,A-857,Kevin White,2020042,question,7,hectordavis@example.net,55999,68729,62509,8127848842,Possible politics green leave opportunity off. Gun end crime yourself right serve line. Dark hit health increase trial public.,2002-04-26,1986-02-26,Julie Walsh,2020099,carry,8,martinkirby@example.net
93,Double,success,A-419,Kathleen Goodwin,2019029,detail,4,victoriashort@example.org,85482,85117,40048,8502622187,"None TV garden. Despite other result down fall maintain. Huge glass wonder why feeling service.
Charge word talk sit think concern the. Next sport deal. Manage agency most.",1970-05-12,1981-06-12,Amanda Ward,2024068,listen,6,fbullock@example.net
94,Double,area,A-985,Lisa Montgomery,2023048,sport,5,perrysteven@example.com,80358,85638,97078,001-356-957-8316x19752,"Point year one project behind member sit. Film chance buy church on start.
Town difficult authority but. Cost red country arrive and magazine.
True soldier base face test cell material.",2011-06-15,1982-02-17,David Mckinney,2024095,account,9,parkertimothy@example.com
95,Double,soldier,A-744,Yolanda Serrano,2020028,raise,9,veronicaacevedo@example.org,32234,38059,72722,9172393368,Character law sit skin leader value meeting. Sit art seat street song. Congress similar kitchen those agreement. Fill head our level.,2010-12-08,2006-01-20,Tiffany Woodward,2021076,agent,3,nhancock@example.net
96,Double,character,A-199,Patricia Silva,2024020,from,3,bethlopez@example.net,13585,98281,430,384-928-8095x5288,"Decision race friend. Tv collection usually back size little.
National offer day American. American throw action meeting. Yard family under activity concern agent. By floor that cell all military.",1998-07-17,2011-01-02,Joseph Riggs,2023082,support,5,stuartwatts@example.net
97,Double,seem,A-133,Aaron Jones,2023005,majority,0,carriejones@example.com,95850,58250,54648,588-858-2142,"Community nation here. One early way perform author movie other change.
Into instead she present.",1979-09-21,1994-05-18,Makayla Gibson,2020028,herself,7,jeffreysavage@example.net
98,Married,suffer,A-475,Whitney Oneill,2020060,person,5,lmaldonado@example.com,55874,28591,3182,+1-395-347-4773x36662,Myself one knowledge miss. High early ball her campaign help rest. Activity section like together then cost college one. Knowledge crime charge do.,2016-07-09,1976-01-09,Joseph Fernandez,2024006,player,1,ortizjames@example.net
99,Single,magazine,A-561,David Dunn,2020065,authority,9,stephenoneal@example.org,38350,94312,33434,001-666-674-4324x287,"Note list buy responsibility. Country read dark sea author more top market. Fast give born partner. Floor sell case commercial matter rock.
Hope show stage hold. Your provide research front business.",2015-06-08,1971-04-06,Miguel Burns,2020059,thank,7,jared30@example.com
100,Single,key,A-509,Robin Christian,2024002,itself,8,ecampbell@example.org,61586,78832,52368,+1-788-618-5585x430,"Consumer part light sense face dream college. Say perform compare local.
Strong hot speech nearly strategy today.
Role myself different.",1980-01-28,1996-09-04,Robin Gonzalez,2023046,maintain,3,zmiller@example.com
