Date,Name,Contact,Medicine Name,Quantity,Room No,Time,Roll No,Signature,Purpose,Security Signature
2004-04-27,Cindy Craig,(593)673-0655,early,55,A-28,19:08:21,998988,David Decker,Early picture speak deal popular center.,Christopher Hendrix
2015-12-08,Martin Grant,+1-764-286-3307x139,wish,24,A-680,20:41:12,571604,Isaiah Dickerson PhD,Information allow ability probably this event.,David Williams
2009-02-05,Joshua Mason,001-847-399-9569x75444,without,98,A-549,04:37:21,201422,Parker Bauer,Entire understand several stock fish blood baby even.,Daniel Castillo
2020-02-19,Frank Smith,001-745-658-8838x73370,some,47,A-453,11:49:18,667393,Sarah Webster,Particular say material.,Charles Walker
2004-03-14,Michelle Johnson,(567)576-2797,fast,59,A-915,18:31:26,311287,Joan Shaw,Open full party.,Kyle Moore
1989-12-12,Kimberly Robertson DDS,855-731-5977x973,turn,64,A-569,07:05:03,56400,Manuel Thompson,Believe various near whether best.,Brandy Castillo
1983-09-15,Charlene Henry,896.259.4985x8456,know,73,A-812,06:28:12,159591,Dr. Sharon Cruz,Million writer around continue never current.,Jessica Turner
2012-02-04,Kayla Franklin,492-889-2437,often,81,A-986,15:24:56,215361,Ray Price,Often though light foot already.,Angela Hobbs
2015-07-03,Anna Hill,(935)697-4143,Congress,89,A-913,06:43:54,950262,Helen Peterson,Author arm avoid.,Heather Lowe
1998-11-18,Tim Schroeder,(446)843-2982x3182,commercial,46,A-295,02:47:55,38896,Makayla Lynch,Religious opportunity along decade do quality.,Darlene Gray
2012-03-31,Jason Holmes,480-520-5380,already,46,A-562,12:17:17,903852,Barbara Rich,Win level most dinner discuss woman yeah.,Kimberly Miller
1998-07-18,Kyle Dunlap,+1-709-447-1267x815,pay,68,A-127,00:01:50,429797,Thomas Cole,Identify it good rise.,Tina Ross
2006-11-16,Jill Rogers,543.886.8795x44313,station,22,A-433,16:47:38,236322,Kevin Robinson,Spend four add protect bad reflect.,Joseph Arroyo
1993-03-12,Maria Glenn,(308)216-5026x69704,so,23,A-612,21:36:51,861578,Donna Brown,After raise rather visit meeting cup.,Alexis Padilla
2019-04-27,Jordan Martinez,6865989127,else,72,A-695,13:12:31,355505,Robert Wallace,Mention general them civil.,Lisa Aguilar
1971-11-29,Dylan Miller,5437069093,general,11,A-732,09:33:16,15689,Joshua Malone,Action office herself card coach far.,Laura Brock
1970-02-08,Linda Moore,345-734-9347,race,96,A-392,00:16:33,6407,Tricia Wade,Seem community star.,Lauren Sanchez
1979-11-21,Rachel Bryant,806.208.7211x413,officer,70,A-872,18:14:13,696099,Susan Allen,Life thought stuff.,Travis Jenkins
1999-06-19,Joshua Lozano,243.692.2150x75548,beyond,36,A-773,06:37:19,214571,Joy Sullivan,Near ever culture quickly sing hard.,Sandra Taylor
2018-11-11,Phillip Molina,534.202.7222x006,herself,37,A-477,15:22:59,919779,Tammy Stevens MD,Result recently word local hair.,Steven Rivera
1996-04-17,Michael Turner,+1-525-695-1357,response,43,A-831,05:53:55,186780,Joseph Hill,Ago whole much.,Veronica Pearson
1998-01-18,Shane Davis,367-356-2062x7920,forward,46,A-501,19:26:12,678723,Carmen Walters,Yet claim best television hope.,Dawn Calderon
2005-05-12,Tonya Collins,001-326-291-0932,there,5,A-104,20:49:44,464411,Janet Flores,Security public goal building animal year.,Steven Gutierrez
1979-08-24,Lisa Cain DVM,695-782-4063,already,42,A-533,12:18:46,532362,Tiffany Peck,Use industry program.,Brian Wilkinson
2004-07-03,Lindsey Ford,990.530.1898x911,watch,56,A-24,13:30:20,837812,Catherine Barron,Consumer send tonight physical radio alone democratic.,Alex Sandoval
2000-04-21,Laura Morales,7626266583,forget,40,A-449,07:27:54,323313,Terrance Colon MD,Better everything idea at view individual matter.,Rebecca Blair
1986-02-13,Chad Becker,633.746.6323x579,kid,75,A-792,03:05:44,195667,Hunter Doyle,Effect information charge education thank above marriage over.,Johnny Murphy
2000-12-25,Michelle Gill,309.590.1079,painting,40,A-830,01:22:19,897518,Todd Lee,Measure everybody message her culture industry.,Philip Mckinney
1984-04-08,Robert Gonzalez,682.640.1574x32595,position,27,A-162,08:33:10,477080,Mia Collins,Cost quality would thing before situation.,David Herrera
1988-04-16,Matthew Jennings,001-869-466-7533,lawyer,5,A-723,09:08:02,192227,Valerie Gonzalez,Between fall when where performance space.,Scott Perez
2017-03-16,Cindy Zamora,(326)472-4132x27860,professional,44,A-493,06:18:50,973100,Mark Perez,Become space president inside continue.,Stephanie Thomas
1987-12-28,Dustin Nguyen,215.466.9445,white,62,A-383,04:48:51,966321,Lisa Rice,Knowledge service road theory state.,Todd Clark
1998-07-13,James Fields,+1-227-814-6886x15484,often,37,A-655,08:37:35,904434,Jacqueline Stevens,Set interesting charge according sit.,Brandy Ellison
1983-01-25,Brandon Collier,+1-489-465-4514,too,0,A-950,04:31:20,801307,Jamie Cook,Top cultural style ask fear.,Marisa Yu
1991-06-03,Tiffany Sullivan,+1-261-337-0712x318,system,85,A-955,18:14:18,272440,Justin Lara,Wait figure take whether doctor.,Amy Delgado
2000-04-02,James Estes,+1-491-520-0607x674,term,2,A-825,10:06:30,395041,Mrs. Ashley Chapman,Method hundred game treat result realize.,Christina Brady
2016-08-31,Heather Daniels,4046062978,phone,78,A-843,12:27:47,196569,Andrea Ewing,Key if discuss reason pull strategy.,James Frazier
1975-03-25,Alan Diaz,(491)305-4704,group,19,A-200,03:21:16,498325,Ashlee Donaldson,Side Mr matter star.,Spencer Bush
2001-02-09,Bryce Bishop,5943094229,reality,91,A-454,18:17:08,774038,Daniel Sanders,State shake law decide rock heart style buy.,Timothy Erickson
2005-08-22,Cynthia Griffith,410.773.9021,statement,4,A-788,16:59:37,479311,Laura Chavez,Training star effect.,Nancy Rodriguez
2020-04-06,Ashley Ellis DDS,254-504-5199x5025,unit,19,A-318,13:48:30,278440,Benjamin Thompson,Third over event skin.,Benjamin Carter
2001-01-04,Steven Melton,(247)497-1123x08237,thing,54,A-312,16:47:49,460472,Mark Byrd,Company brother let institution.,Brandon Juarez
1975-03-09,Edward Guzman,981.482.6644x01299,executive,3,A-992,21:25:53,845736,Savannah Burke,To east fund.,Joshua Brown
2017-10-15,Lindsey Wu,853-573-0256x45802,knowledge,35,A-508,13:52:16,307169,Rachel Christensen,Capital population process spring service by hour.,Donald Barber
2007-12-01,Cameron Walker,+1-678-874-6537x9354,top,34,A-840,07:22:13,809358,Nicole Hale,Follow reason doctor something trade little.,Terrance Cooper
2013-01-17,Joseph Santos,+1-624-524-8625x9775,election,66,A-696,12:14:36,829008,Alicia Turner,Knowledge police simply light against speech guy both.,Juan Cooper
1974-07-04,Richard Adams,688-543-0038,performance,6,A-417,13:34:39,210019,Brittney Nolan,Address while town argue.,Mackenzie Brown
1970-02-02,Natalie Tucker,701-705-7955,event,8,A-258,18:46:11,622469,Danny Brown,Pattern likely room consumer between.,Paula Evans
1974-03-03,Kayla Mcpherson,+1-482-902-2408x8112,require,69,A-852,06:00:18,526759,Henry Moody,Every turn together social.,Sara Brown
2003-03-17,Cody Smith,(578)408-6143x05528,share,40,A-538,08:00:29,991536,Justin Harris,May mind local huge.,Jennifer Meadows
1987-12-07,Sharon Solis,001-524-516-8333x275,indeed,29,A-521,15:57:00,222677,Jill Young,Social recent through.,Jim Hawkins
2013-01-26,Ronald Shepherd,299-797-2423x545,ok,35,A-26,17:09:44,209093,Matthew Reyes,Recent close thousand shoulder guy citizen carry there.,Jennifer Flores
2012-11-11,Anna Anderson,+1-882-621-8707x50950,mouth,16,A-949,22:58:31,394522,Robert Chapman,Somebody office member growth industry.,Jennifer Johnson
2000-09-06,Chris Morris,001-979-654-9526x2357,audience,25,A-326,10:32:27,68448,William Berry,Ten technology friend effort theory.,Christine Shepherd
2002-08-30,Lisa Tucker,604-941-4664x37418,industry,52,A-643,12:35:09,826240,Brandon Carroll,Foot interesting term especially scene standard.,Jamie Benjamin
1998-04-11,Michelle Munoz,747.663.9193x24961,dinner,64,A-986,10:37:20,54792,Laura Garner,Change happen oil.,Sarah Morgan
1988-06-12,Jennifer Cook,001-814-761-2524x02311,party,48,A-744,01:05:46,686906,Molly Guzman,So certain leave provide property agreement.,Brooke Brown
1988-03-23,Trevor Roberts,224-729-9654x2611,main,72,A-289,10:35:08,15168,Daniel Vasquez,Enough head they speak American dark affect under.,Devin Randolph
1994-10-13,Tammy Sawyer,001-536-869-5829x084,north,31,A-597,16:49:35,949921,Aaron Chen,Apply hear test should.,Diana Huber
1983-05-02,Frank Harris,(260)471-5269,eight,24,A-794,18:00:52,776495,Mr. Terry Holland,Civil suffer standard away program.,Ashley Hanson
1998-11-08,Tommy Johnson,439-520-5521,close,15,A-101,03:53:43,533781,Tiffany Barnes,Discuss travel mean.,Brenda Austin
1979-06-08,Jessica Scott,4629167989,career,42,A-556,17:50:13,157577,Andrew Stephens,Some region wish which huge how investment response.,Nicholas Jones
2015-08-08,Morgan Baker,(941)218-5655x3248,us,40,A-561,23:52:20,920963,Michael Stewart,Pretty style traditional the.,Jeanne Bass
1990-01-24,Troy Burns,2265410045,factor,14,A-151,09:33:31,423182,Jason Craig,Minute hit hundred enjoy have.,Joel Welch
1973-07-28,Robert Herman,+1-852-483-8231x3885,professional,50,A-857,14:15:44,450030,Lisa Bond,Gas too seek drop decision man different.,Cody James
2004-01-08,James Cox,+1-672-333-2754,energy,1,A-259,06:31:51,306510,Michael Johnson,Total anyone begin mention popular impact local.,Christine Baker
1986-05-08,Melissa Munoz DDS,638.595.5184x92001,lay,22,A-707,12:02:42,255327,Rachel Chavez,Eat traditional issue interest bill hit.,Colton Salinas
2000-11-30,Janet Lopez,001-765-451-8725x26055,employee,69,A-635,13:24:37,446503,Robert Stewart,Ball draw skill dark debate camera.,Walter Fitzpatrick
1998-07-27,Sheila Stanley,455-387-0381x2599,smile,59,A-509,18:39:06,295765,Leonard Martinez,Bar challenge section before garden nation foreign.,Kenneth Little
1996-11-13,Andrew Butler,001-204-794-7944x233,decision,35,A-824,04:11:54,557433,Timothy Monroe,Seven economic campaign on happy only north.,Renee Huang DDS
2001-04-02,Mark Brown,517.904.7999x933,office,66,A-27,22:09:35,501669,Eric Harrison,Spring rate protect artist consumer against each.,Michael Thomas
2012-03-06,David Lara,376-978-9904x4293,enjoy,82,A-284,04:54:10,828361,Russell Kane,Effort player affect budget indeed perform.,Jennifer Greer
1974-07-14,Duane Allen,+1-451-637-3102,speak,23,A-578,11:30:52,801575,Kelly Hopkins,Hospital practice image seem include sister.,Kevin Moody
1980-07-05,Stephen Richards,872-372-2619,pull,48,A-267,11:03:41,562423,Alexis Adams,Probably reduce who traditional image foreign.,James Durham
2017-02-14,Greg Thornton,860.780.8321x571,skin,32,A-339,01:19:58,856140,Michael Chavez,Adult large choose parent dog.,Melissa Martinez
1982-09-02,Michael Burnett,(865)890-4501,if,48,A-948,09:25:38,369251,John Kramer,Local glass make teacher including.,Michael Finley
2008-05-13,Jessica Hamilton,996-437-8390,ask,70,A-172,15:56:00,79172,Kathy Lewis,Clearly north effect wall.,Johnny Reynolds
1992-05-11,Jared Simon,(921)386-6267x97191,near,70,A-503,09:34:39,655686,Jason Garza,Case bed agency own.,Samuel Smith
1994-01-14,Andrew Wilson,001-520-550-9753x10518,cost,75,A-700,03:47:49,569720,Nancy Guerra,Fire since event exactly you.,Gregory Meyer
1988-10-03,Isaac Glenn,282-860-7558,second,0,A-216,11:07:01,613002,David Ramirez,Guy catch husband keep.,John Vega
1973-06-02,Nathaniel Miller,001-385-366-7445,per,63,A-531,08:26:35,40826,Angela Manning,Hit pressure I kind condition material.,Yvette Mitchell
1992-02-08,Emily Harrison,483-672-1765,activity,7,A-157,22:56:49,561531,Carolyn Mccoy,Too end social he.,Donald Patel
2007-07-13,Katherine Cook,7476091129,owner,63,A-322,23:54:37,455805,Allison Dixon,Add member compare respond evening.,Cody Tucker
1996-04-01,Gregory Jordan,402-660-3649x538,church,33,A-872,17:41:39,919536,Michael Allen,Try even theory shake American serve technology.,Craig Porter
2023-06-01,Jennifer Stanley,001-586-908-8808x642,describe,27,A-699,18:41:07,190974,Amy Mathis,Type us store suggest various within.,Audrey Wilson
1985-02-06,Katherine Knight,+1-455-778-1899x0892,blue,4,A-881,17:47:40,364661,Jeremy Martinez,Risk performance moment say miss.,Michelle Mclaughlin MD
2012-02-12,Jamie Morse,6839071244,garden,63,A-695,18:38:23,738188,Kathleen Parks,Involve peace common language sea.,Jacob Hernandez
2003-07-12,Andrea Howard,+1-353-521-4758x52600,seem,97,A-749,20:54:19,406296,Brian Brown,Relationship choose now become ahead seek.,Gary Morgan
1994-06-18,Isabel Blanchard,+1-636-585-4369x9223,agent,22,A-202,15:15:09,683038,Laura Sanchez,Provide phone plan method assume.,Mr. Joshua Freeman
1974-12-15,Tiffany Gray,+1-422-225-8207x523,allow,40,A-754,22:52:30,733670,Elaine Nichols,Become hit able trouble capital case open then.,Kenneth Fry
2023-08-24,April Owen,791.691.9242,consider,31,A-340,14:05:15,753125,Laura Benton,Strong discover debate edge home Mrs oil.,Alicia Ramos
1975-11-25,Caitlin Hunter,001-811-818-5843x367,set,31,A-141,08:31:26,274077,Elizabeth Hayden,Summer reveal pick former would meet.,Pamela Parrish
2009-05-22,Luis Johnson,+1-224-961-7801,protect,92,A-625,17:33:05,967545,Thomas Chapman,Detail simply difference site head whatever blood.,Danielle Sheppard
1972-08-30,Joel Frazier,001-785-959-8352,owner,56,A-931,03:17:00,133740,Kathleen Beltran,Difference anyone federal drug should computer resource garden.,Joel Ruiz
1982-05-15,Amanda Freeman,(692)856-8130,score,16,A-270,04:02:19,733978,Kathy Dyer,Site at beautiful.,Barbara Franco
2014-04-03,Emily Hood,001-788-385-2325x075,name,63,A-592,13:49:39,862933,Erica Peters,Door without wrong organization two industry that.,Dr. Samantha Norris
1987-06-06,Natasha Doyle,001-269-643-5826x04401,minute,16,A-390,09:31:37,27444,Alex Powers,Campaign either short street detail level.,Jennifer Torres
2022-05-16,John Ford,001-622-428-2200,ball,63,A-457,07:53:37,241769,Samantha Mcdowell,Film skin however far big wrong fish.,Kristina Fuentes
1997-03-23,Andrea Everett,716-652-5362x7565,body,5,A-248,16:35:33,203258,Michelle Strickland,Sort seem everyone indeed appear specific.,Jeremiah Briggs
1995-07-29,Dr. Gregory Mills DDS,4057172349,economy,55,A-78,10:22:30,928098,Angela Jimenez,People whose top item loss success.,Eric Jackson
