Date,Name,Contact,Medicine Name,Quantity,Room No,Time,Roll No,Signature,Purpose,Security Signature
1995-06-30,Reginald Griffin DDS,3123956414,rise,98,A-779,12:25,2020204,Reginald Griffin DDS,Recent onto such data claim defense couple police.,Kevin Ellison
2016-07-21,Nicholas Kelly,9253721535,pull,31,A-27,04:10,2023972,Nicholas Kelly,Particular health hard describe recently early agreement.,Marc Glass Jr.
1976-08-14,Valerie Mitchell,8291063432,be,9,A-470,01:38,2019330,Valerie Mitchell,Sit mission certain read born concern.,Brooke Kerr
2010-10-13,Nicholas Kelly,9253721535,seven,67,A-905,03:44,2023972,Nicholas Kelly,Worker draw suggest performance.,Nancy Booth
2015-05-25,Stephanie Patton,6404596033,professional,61,A-40,01:06,2020398,Stephanie Patton,Debate consumer camera television provide.,Amy Cooper
1974-10-27,Emily Andersen,5217133733,draw,4,A-465,08:33,2019142,Emily Andersen,Later explain heart under guess own pass.,Nicholas Watson
1974-02-05,Terry Lewis,5958398328,development,6,A-663,04:18,2020792,Terry Lewis,Interview case knowledge dark.,Amy Roberson
2015-08-22,Diane Martinez,2429768113,before,22,A-303,12:21,2019388,Diane Martinez,Trip voice very financial company party let.,Derek Gilmore
1991-02-06,Brian Goodwin,768265978,job,80,A-362,21:35,2019277,Brian Goodwin,Care too figure risk long.,Mark Williams
2000-07-20,James Glover,7420847170,operation,35,A-791,20:55,2023296,James Glover,Pattern worker half.,Timothy Huynh
2022-09-08,Matthew Martinez,5104202509,suddenly,49,A-814,21:38,2022714,Matthew Martinez,Deep real which a change a.,Cory Valenzuela
2013-02-20,Reginald Griffin DDS,3123956414,would,84,A-461,23:24,2020204,Reginald Griffin DDS,Arm alone test stock car.,Amy Erickson
1988-02-01,Rebecca Reid,34839076,environment,52,A-891,09:05,2018728,Rebecca Reid,Business worry town paper century enough.,Andrew Frey
1983-07-19,Dennis Leblanc,8472409546,risk,53,A-293,07:40,2023641,Dennis Leblanc,Single nice pattern.,William Johnson
1995-12-03,Dennis Leblanc,8472409546,fall,2,A-436,03:57,2023641,Dennis Leblanc,Parent base prepare choose despite author state.,Sara Stephens
2018-06-16,Steven Kim,7720006808,matter,30,A-636,04:41,2022177,Steven Kim,Build drop a.,Tiffany Clayton
1978-11-01,Brian Goodwin,768265978,strategy,93,A-595,16:50,2019277,Brian Goodwin,Push charge issue either about.,Alyssa Reid
1973-03-28,Allison Warren,8761404690,help,73,A-790,04:59,2019863,Allison Warren,Beyond fear foot specific.,Adam Ray
2014-01-13,Rebecca Reid,34839076,girl,37,A-916,16:18,2018728,Rebecca Reid,Necessary indicate effort clearly same step movie face.,Jonathan Cook
1972-06-01,Brianna Day,8738320308,detail,13,A-425,06:07,2018877,Brianna Day,Girl group just clearly focus standard yes.,Hector Walters
1992-05-27,Charles Owens,6692668874,use,69,A-418,13:56,2020345,Charles Owens,Do then wear wish Mr.,Joseph Mitchell
2018-06-06,Lisa Ruiz,2637200141,candidate,51,A-994,09:14,2024554,Lisa Ruiz,Soldier among age within.,Christopher Wilson
1990-02-12,Nicholas Kelly,9253721535,factor,46,A-415,04:15,2023972,Nicholas Kelly,Step rate view.,Lisa Allen
2010-02-12,Michelle Chapman,5672713167,loss,67,A-932,10:46,2019993,Michelle Chapman,Build ball evidence help necessary vote money structure.,Jamie Gill
2016-06-05,Joshua Mora,9380738166,federal,19,A-907,02:17,2023571,Joshua Mora,Different Republican sea leg write.,Michele Dunlap
1987-08-09,Tyler Phillips,7082449443,bed,73,A-93,05:04,2019125,Tyler Phillips,Prove rule hear entire.,Christopher Powell
1973-12-29,Amanda Church,2387870839,ago,67,A-146,00:29,2019751,Amanda Church,Case base writer participant member law.,Theresa Carroll
2007-02-21,Meghan Holder,9309800921,what,14,A-877,05:40,2019674,Meghan Holder,Quality west carry agency audience deep.,Kayla Neal
2006-02-15,Lisa Ruiz,2637200141,field,52,A-24,15:03,2024554,Lisa Ruiz,Light her north price force.,Jessica Sanchez
1999-07-19,Kimberly Fitzgerald,6258650351,able,5,A-188,13:36,2022002,Kimberly Fitzgerald,Always PM knowledge.,Jean Campbell
1973-11-06,Amanda Bell,6756839785,when,71,A-646,16:08,2020748,Amanda Bell,Local agent political century skin training.,Jason Sheppard
1995-12-16,Tammy Green,5171868410,finish,22,A-613,18:08,2022886,Tammy Green,Whether national rather identify.,Chad Harris
1990-02-27,Tyler Phillips,7082449443,listen,24,A-461,02:14,2019125,Tyler Phillips,Suggest country marriage more.,Lisa Morris
2020-01-18,James Horn,349114363,west,47,A-329,22:03,2021963,James Horn,Item sometimes however court kitchen whom talk.,Erin Clarke
2015-12-20,Daniel Smith,1222473697,member,13,A-670,11:52,2020096,Daniel Smith,At leader father above purpose prove.,John Graves
2021-01-24,Susan Sparks,338996029,senior,14,A-61,12:57,2023685,Susan Sparks,Management election it citizen entire with.,Julie Rodriguez
2019-12-24,James Glover,7420847170,employee,53,A-666,00:25,2023296,James Glover,Near this check film room popular.,Ebony Cordova
2021-06-20,Samuel Harvey,6425873580,option,91,A-247,13:53,2024580,Samuel Harvey,This create rate activity without.,Tonya Nichols
1991-05-25,Bethany Cooper,47642350,light,14,A-378,01:45,2021098,Bethany Cooper,Structure cut skin far.,Brandi White
1996-05-31,Randall Nelson,4974142327,decision,94,A-18,02:25,2022677,Randall Nelson,Hospital hard smile arm spend purpose.,Victoria Brown
1995-07-01,Randall Nelson,4974142327,home,2,A-428,01:08,2022677,Randall Nelson,Mind those school thing line general executive.,Richard Garcia
1999-03-23,Reginald Griffin DDS,3123956414,finally,9,A-107,04:57,2020204,Reginald Griffin DDS,Catch box wind give instead which sit.,Dr. Clayton Mays II
2008-12-11,Erica Bennett,7066250990,unit,40,A-487,07:36,2023180,Erica Bennett,Church onto appear front then they.,Jeremy Grant
2005-10-14,Marcus Snyder,2614763861,big,42,A-606,18:16,2019718,Marcus Snyder,Compare moment story security expect including.,Kelly Ferguson
2009-12-21,Kimberly Henderson,4950606144,hand,74,A-307,12:27,2021686,Kimberly Henderson,Hundred throw parent leg practice who.,Julia Hardy
2018-09-02,Frank Chambers,5817237790,five,66,A-622,22:20,2021585,Frank Chambers,Figure before investment fight.,Lisa Lawrence
2019-05-15,Felicia Henderson,5189474729,challenge,63,A-591,17:51,2021587,Felicia Henderson,Lay word career campaign.,William Cisneros
2018-10-24,Dana Rogers,6647732773,she,78,A-33,18:11,2019837,Dana Rogers,Both base run hand bring place.,Kaitlyn Johnson
1979-06-29,Marcus Snyder,2614763861,nature,97,A-951,22:10,2019718,Marcus Snyder,Hot full again those military.,Steven Mason
2022-12-28,Stephen Clark,4782334369,yard,95,A-358,20:06,2024676,Stephen Clark,Those million simply.,Laura Blake
1978-01-21,Kathleen Brady,5765300668,simply,97,A-430,00:51,2023862,Kathleen Brady,Attack Democrat radio chance media.,Mrs. Sarah Davis
1977-03-31,Stephanie Patton,6404596033,around,17,A-835,02:47,2020398,Stephanie Patton,Similar these letter.,Matthew Diaz
1988-09-23,Sherry Mccormick,9777623455,score,82,A-635,11:30,2018704,Sherry Mccormick,Challenge model everything somebody protect try.,Mario Johnson
1973-09-27,James Bradley,1027873870,mention,49,A-646,07:41,2024505,James Bradley,Choice listen exist allow position great.,Paula Ford
2007-12-03,Sara Robinson,8030389721,media,71,A-333,10:41,2024007,Sara Robinson,President bank worry account instead join analysis moment.,Laura Henry
1972-10-07,Marco Bird,1608988126,record,75,A-971,16:41,2019634,Marco Bird,Military home write project subject fund.,Crystal Perez
1990-06-04,Ricardo Richards,8072621134,produce,29,A-712,22:53,2020148,Ricardo Richards,Edge eight despite leader boy participant look.,Angela Brown
2017-01-27,Noah Obrien,6471595418,as,47,A-45,08:54,2020579,Noah Obrien,Tv wall action break.,Patrick Herrera
2021-06-03,Allison Warren,8761404690,tell,98,A-272,06:30,2019863,Allison Warren,Huge left huge control.,Cassandra Ryan
1976-06-07,Nicholas Kelly,9253721535,on,6,A-755,19:21,2023972,Nicholas Kelly,Air physical trade glass customer positive.,Jenna Powell
1985-05-03,Amanda Bell,6756839785,often,76,A-226,12:15,2020748,Amanda Bell,On realize when.,Stanley Tran
2013-02-12,Maria Thornton,4479532547,stand,73,A-726,01:50,2019309,Maria Thornton,Health modern leg media structure.,Joshua Baker
2011-09-01,Stephen Clark,4782334369,two,53,A-145,19:01,2024676,Stephen Clark,Western record become.,Robyn Smith
2002-11-07,Susan Sparks,338996029,two,17,A-995,09:20,2023685,Susan Sparks,Hot among all able individual.,Jennifer Torres
1987-05-27,Matthew Martinez,5104202509,face,91,A-701,21:38,2022714,Matthew Martinez,Policy project common stay now.,Amber Richardson
1971-07-19,Reginald Griffin DDS,3123956414,plant,54,A-17,01:57,2020204,Reginald Griffin DDS,Wait market standard management ok.,Mr. Paul Horton
2009-12-01,Ryan Salazar,788824731,cultural,15,A-872,22:32,2023540,Ryan Salazar,Ball rise federal close ever.,Denise Kim
1992-04-29,Gerald Wright,454394925,real,90,A-400,20:15,2024562,Gerald Wright,Talk school focus professor shoulder president manage.,Mr. Jonathan Butler
2019-12-21,James Bradley,1027873870,pass,64,A-521,14:36,2024505,James Bradley,Brother off last use enter Congress.,Michael Bender
1981-04-16,Valerie Mitchell,8291063432,reality,70,A-618,22:28,2019330,Valerie Mitchell,Final international light drop great miss.,Joseph Mcbride
2006-08-09,Joshua Henry,8674438358,police,85,A-542,10:26,2021705,Joshua Henry,Coach make since play keep.,Diane Cabrera
1994-05-05,Katherine Kelly,5195734867,tend,58,A-42,22:51,2019723,Katherine Kelly,Certain red eye there discussion.,Matthew Fitzpatrick
1978-05-20,Jeremiah Wilson,9837528098,home,85,A-938,19:04,2018669,Jeremiah Wilson,Involve upon safe lawyer shake season decade rate.,Destiny Riley
1992-05-17,Kathleen Brady,5765300668,sister,41,A-640,18:09,2023862,Kathleen Brady,Simple receive attorney.,Robert Hodges
1974-05-28,Lisa Ruiz,2637200141,agency,56,A-899,04:40,2024554,Lisa Ruiz,Order away word participant into its.,Sean Dennis
1974-08-16,Samuel Harvey,6425873580,investment,68,A-163,01:44,2024580,Samuel Harvey,Reach second always care anything popular huge thank.,Jacqueline Matthews
1995-05-06,Randall Nelson,4974142327,pretty,54,A-879,02:16,2022677,Randall Nelson,Wind member adult religious budget would public whether.,Keith Henderson
1978-05-17,Samuel Harvey,6425873580,type,5,A-266,19:03,2024580,Samuel Harvey,Rate prepare note single source PM.,Amy Guzman
1987-11-22,Daniel Flores,3872090483,statement,65,A-848,15:24,2021137,Daniel Flores,Believe involve start dinner.,Renee Turner
2009-02-15,Elizabeth Rogers,4141345037,help,41,A-726,14:08,2018384,Elizabeth Rogers,During we seem camera opportunity read.,Guy Oneal
2004-06-29,Dana Rogers,6647732773,back,90,A-394,02:13,2019837,Dana Rogers,Consider save feel.,Megan Moreno
1998-04-06,Felicia Henderson,5189474729,artist,88,A-71,20:54,2021587,Felicia Henderson,Again clear our wife.,Mallory Phillips
1999-03-30,Noah Obrien,6471595418,may,87,A-574,15:17,2020579,Noah Obrien,Perhaps important relationship director body item Congress.,Kevin Williams
2007-02-24,Jorge Nichols,8494862951,only,79,A-556,15:55,2021018,Jorge Nichols,Tree star particularly degree spend protect worry.,Mallory Martinez
1988-08-27,Valerie Mitchell,8291063432,campaign,52,A-381,02:05,2019330,Valerie Mitchell,May responsibility yard whole model.,Daniel Mitchell
2007-01-07,Sherry Mccormick,9777623455,old,27,A-517,04:43,2018704,Sherry Mccormick,Institution reach behind drug first.,Lisa Ortiz
2014-06-03,Tina Robertson,5985829974,allow,42,A-275,06:59,2019156,Tina Robertson,Get it let continue market big account.,Jacqueline Bowman
1987-03-13,Tammy Green,5171868410,weight,97,A-705,07:05,2022886,Tammy Green,Seek final kitchen above during.,Bradley Oliver
1986-12-22,Mark Henson,3208968553,amount,76,A-144,05:56,2022935,Mark Henson,Senior base Democrat reach rise staff sit.,Lori Reynolds
1971-04-12,Rebecca Reid,34839076,protect,65,A-729,03:52,2018728,Rebecca Reid,Office ground cultural type receive.,Mark White
2020-03-02,Cynthia Simmons,7087867601,none,83,A-846,14:51,2021343,Cynthia Simmons,Remember speech off girl sit whether suggest.,Chad Solis
1975-12-27,Tyler Hendricks,5411980716,performance,25,A-626,18:41,2018941,Tyler Hendricks,Police hospital forget music along challenge factor.,Terry Miles
1994-11-30,Tyler Hendricks,5411980716,how,23,A-294,21:24,2018941,Tyler Hendricks,Draw serve begin meet.,Julie Kaufman
2021-09-20,Mark Henson,3208968553,computer,29,A-53,01:06,2022935,Mark Henson,Go these book development quickly up.,Danielle Nichols
1997-05-31,Timothy Boyd,8140526450,particularly,7,A-354,05:41,2021288,Timothy Boyd,Research body success behind pick live head.,Traci Stevens
1991-03-27,Terry Lewis,5958398328,term,95,A-606,04:08,2020792,Terry Lewis,Bit outside them occur general could.,Wendy Harrison
1979-10-21,Allison Warren,8761404690,group,79,A-772,17:59,2019863,Allison Warren,Show catch herself scientist friend.,Megan Anderson
1973-01-06,Ashley Jensen,7617140392,tell,26,A-430,00:03,2019008,Ashley Jensen,Several around accept population.,Teresa Guzman
2018-11-19,Tina Phillips,6461687461,dark,48,A-8,14:26,2020891,Tina Phillips,Rock face face.,Joshua Odonnell
1997-08-08,Sherry Mccormick,9777623455,action,69,A-815,06:55,2018704,Sherry Mccormick,Energy work important could program call.,Derek Gonzalez
