Date,Name,Contact,Medicine Name,Quantity,Room No,Time,Roll No,Signature,Purpose,Security Signature
1995-08-28,Thomas Jones,1096805354,college,83,A-432,23:37,2018017,Thomas Jones,Short somebody impact last specific modern outside.,Heather Russell
1992-02-10,James Guerrero,9927691050,war,51,A-269,04:55,2023019,James Guerrero,Successful catch evening movement laugh.,Stephanie Davis
2011-02-23,Elizabeth Snyder,9498251804,option,17,A-443,20:29,2021090,Elizabeth Snyder,Speech despite this east she myself than.,Deanna May
2003-10-18,Victoria Thompson,8308969686,down,57,A-692,20:12,2019047,Victoria Thompson,Various almost help drug window get.,Katherine Johnson
1996-09-22,Thomas Jones,1096805354,these,22,A-936,13:44,2018017,Thomas Jones,Cultural wide nice Congress cold seek.,Trevor Charles
1974-04-08,Elizabeth Snyder,9498251804,phone,81,A-3,15:43,2021090,Elizabeth Snyder,Particularly total still herself others will pull.,Alan Buchanan
2005-02-01,Scott Bean,6664324678,career,18,A-738,05:29,2020020,Scott Bean,Social city career owner skin agent.,John Meadows
1991-09-23,Michael Russell,897784417,write,67,A-440,21:23,2020023,Michael Russell,Think Mrs civil fact pressure size.,Jessica Brewer
2003-08-12,Mr. John Morgan,3379406877,for,94,A-296,15:29,2024012,Mr. John Morgan,Letter after off wear.,William Vazquez
2011-10-30,Kenneth Walsh,1501059868,eye,28,A-130,21:47,2024080,Kenneth Walsh,Plan bill wrong painting scene eat business.,Andrea Reyes
1984-11-12,Jeremiah Vargas,8762172056,size,83,A-551,08:51,2020054,Jeremiah Vargas,Management yard beat certain never culture.,Timothy Wilson
2007-02-24,Stephen Martinez,7482485908,figure,78,A-174,06:51,2019077,Stephen Martinez,Or play allow level.,Crystal Johnson
1984-05-17,Sylvia Turner,9733698319,consumer,30,A-84,05:09,2019076,Sylvia Turner,Letter happen parent billion gas TV nor.,Katrina Osborne
1979-07-13,Jacob Hill,9376915168,skin,85,A-363,13:56,2024008,Jacob Hill,Strategy identify measure head agreement free.,Whitney Russell
2001-02-20,Jake Nicholson,8645866432,the,1,A-918,18:07,2020070,Jake Nicholson,Itself morning develop may.,Jessica Cole
2005-08-27,Jeffrey Roman,6532980944,bank,27,A-564,23:51,2020039,Jeffrey Roman,Probably since after seek can by speech.,Kimberly Miller
2011-08-18,James Haas,3605464525,idea,19,A-351,00:47,2020004,James Haas,Information audience agency reach information maintain.,Erin Ali
1979-09-30,Amanda Simpson,2529474123,fire,48,A-684,15:30,2020003,Amanda Simpson,Teach senior wear cost minute century.,Jennifer Hull
2006-03-10,Thomas Dougherty,6586507970,cold,77,A-582,05:41,2018073,Thomas Dougherty,Enter business television own song.,Andre Butler
1986-10-09,Kenneth Walsh,1501059868,cause,45,A-414,14:41,2024080,Kenneth Walsh,Interesting follow idea here although candidate.,Linda Middleton
2019-08-28,Stephen Martinez,7482485908,current,34,A-184,16:40,2019077,Stephen Martinez,Loss firm follow.,Joshua Blankenship
1983-10-31,Jake Nicholson,8645866432,toward,9,A-619,12:04,2020070,Jake Nicholson,Everything surface explain feel management.,Nicholas Miller
2012-12-06,Courtney Garrett MD,922017570,magazine,70,A-228,04:01,2019067,Courtney Garrett MD,Would fight organization by bit pull base camera.,Lisa Simpson
1978-12-25,Karla Duncan,3152847665,social,47,A-403,13:15,2022088,Karla Duncan,I letter agency color evening hold.,Jeremy Knight
1996-03-13,Stephen Martinez,7482485908,read,51,A-813,04:56,2019077,Stephen Martinez,Democratic million allow recently rule.,Kayla Bell
1998-05-11,Mr. John Morgan,3379406877,take,46,A-734,08:09,2024012,Mr. John Morgan,Television blue particular he include history.,Richard Parks
2010-02-08,Jeremiah Vargas,8762172056,director,16,A-855,13:00,2020054,Jeremiah Vargas,Owner reveal some southern.,Terri Riley
2014-11-23,Zachary Hoover,5344557038,boy,14,A-517,22:35,2020015,Zachary Hoover,Herself treat network.,Kevin Lloyd
1979-01-07,Heather Nguyen,6127299695,daughter,8,A-377,01:20,2019081,Heather Nguyen,Article fire child case thousand establish vote.,Amanda Blanchard
1990-04-20,James Guerrero,9927691050,move,48,A-771,13:05,2023019,James Guerrero,Take space loss result.,Michael Nelson
1990-09-01,Kaitlin Silva,4980264762,start,67,A-374,06:27,2021041,Kaitlin Silva,Main quality edge Democrat purpose.,Ethan Lynch
1985-01-05,Eric Martin,1045062353,be,74,A-930,14:51,2023062,Eric Martin,Hair eight some series of.,Jennifer Edwards
2010-05-27,Mariah Ortiz,9969067665,sometimes,50,A-524,20:17,2021097,Mariah Ortiz,Evening race education wait.,Elizabeth Ward
1982-07-30,James Anderson,634237814,see,58,A-633,06:25,2023082,James Anderson,Bank strategy one firm agree color occur.,Brittany Smith
1977-06-21,Jessica Rice,3281332951,huge,74,A-487,15:29,2022032,Jessica Rice,Same century financial stock perform serious work.,Sean Young
2008-05-04,Kaitlin Silva,4980264762,idea,34,A-627,02:28,2021041,Kaitlin Silva,Nature threat director thousand eat wind also.,Jeffrey Copeland
1980-07-28,Michael Tyler,6973427434,try,28,A-160,00:41,2019053,Michael Tyler,Force occur compare deal of happy may.,Cheryl Jimenez
2023-03-11,Casey Walker,8172205654,after,63,A-35,15:06,2024031,Casey Walker,Difference no finally every reality author section.,Edward Ruiz
2011-03-15,Lori Wright,8642889037,himself,10,A-272,05:20,2021037,Lori Wright,Newspaper conference director guy raise rich.,Tracy Smith
1993-05-31,Daniel Navarro,848606108,board,62,A-272,03:15,2020011,Daniel Navarro,Visit skin experience again house bring.,Holly Terry
2000-09-01,Samantha Sanders DVM,9873728882,population,21,A-908,18:18,2020035,Samantha Sanders DVM,If enough spend prove police away.,Rhonda Anderson
1973-04-22,Jasmine Lozano,6882602229,report,16,A-705,22:47,2019027,Jasmine Lozano,Suffer make finish economy know.,Christina Stevens
1990-11-26,Stephen Martinez,7482485908,radio,86,A-9,17:04,2019077,Stephen Martinez,Manage live research old only quickly.,Crystal Brown
1980-04-13,Robert Roman,685091178,four,48,A-608,08:04,2022049,Robert Roman,State industry main have when whatever.,Vanessa Morton
2016-12-07,Aaron Rodgers,3435346972,particularly,33,A-884,06:06,2018098,Aaron Rodgers,Long indicate matter cause reflect successful.,Emily Walker
2005-09-19,Whitney Lowe,3612312251,radio,43,A-308,20:31,2023005,Whitney Lowe,Movement them teacher serious most.,Tristan Collins
1971-12-30,Brenda Hernandez,69876783,place,17,A-386,08:20,2023087,Brenda Hernandez,Three discover artist apply woman.,James Rhodes
1978-12-01,John Johnson,4509854213,explain,40,A-179,05:32,2021025,John Johnson,At only job.,Keith Martin
1970-12-24,Karla Duncan,3152847665,ball,0,A-414,12:31,2022088,Karla Duncan,Tell commercial increase nor area hospital south.,Harold Smith
2005-06-24,John Johnson,4509854213,early,1,A-52,16:59,2021025,John Johnson,Expect class news fill career herself.,John Moore
1993-01-23,Carla Lopez DDS,5600940346,hair,61,A-792,13:43,2023022,Carla Lopez DDS,Learn beat recent inside spend happen money.,Joseph Griffin
2007-01-24,Whitney Lowe,3612312251,sure,33,A-219,16:46,2023005,Whitney Lowe,Prepare hard thousand teach ahead staff check raise.,Douglas Johnson
1993-04-04,Emily Rodriguez MD,9629966957,knowledge,10,A-989,02:02,2018052,Emily Rodriguez MD,Maintain add message low kind message poor.,Matthew Chapman
2005-10-17,Brenda Hernandez,69876783,hair,17,A-477,01:48,2023087,Brenda Hernandez,Just coach accept wear whose both.,Timothy Morris
1980-08-14,Chelsey Rojas,4242203561,including,1,A-496,03:41,2024001,Chelsey Rojas,International exactly collection back sing fall friend.,Charles Cook
1991-04-26,Kenneth Walsh,1501059868,direction,2,A-715,07:59,2024080,Kenneth Walsh,Station store see born could else.,Susan Alvarez
1971-03-11,Jessica Rice,3281332951,firm,6,A-888,02:29,2022032,Jessica Rice,Notice back happy call police decade dark.,Jonathan Novak
1991-09-13,Emily Rodriguez MD,9629966957,identify,15,A-781,22:22,2018052,Emily Rodriguez MD,Former focus try style.,Tammy Morgan
1979-05-11,Rebecca Lin,3718152833,energy,22,A-970,12:28,2022056,Rebecca Lin,Protect window full dinner quickly my.,Audrey Wilson
2009-07-06,Eric Martin,1045062353,him,58,A-980,19:38,2023062,Eric Martin,Use system face.,Carrie Tyler
1993-06-12,Amber Garrett,8532993287,eight,52,A-361,14:36,2024013,Amber Garrett,Here race western director cover build individual bill.,Maureen Collins
1986-05-29,Brandon Lewis,1098472281,add,43,A-895,14:02,2021074,Brandon Lewis,Bag and admit hospital both always.,Sherri Gardner
2017-12-10,Greg Williams,6547377674,need,60,A-276,15:08,2019083,Greg Williams,Able particular new sense sell much race.,Michael Hines
2000-05-03,Daniel Wright,7047803128,suggest,87,A-762,03:48,2019064,Daniel Wright,Shoulder find example our.,Roger Ochoa
1980-04-17,Robin Gray,1073485429,another,74,A-888,12:27,2020033,Robin Gray,Condition worker painting they production.,Kayla Barnett
1970-03-16,James Hooper,2406908823,agency,90,A-849,05:11,2020051,James Hooper,Trial box another throw age look toward.,Vanessa Velasquez
1992-11-03,Jeremiah Vargas,8762172056,life,87,A-262,22:17,2020054,Jeremiah Vargas,Explain knowledge part.,Michael Hill
1979-06-08,Mariah Ortiz,9969067665,character,43,A-422,09:23,2021097,Mariah Ortiz,Full issue system others fly.,Michael Hooper
1986-01-20,Mariah Ortiz,9969067665,foreign,7,A-730,09:33,2021097,Mariah Ortiz,Cost important left record.,Taylor Lucas
1976-06-25,Heather Nguyen,6127299695,car,63,A-373,10:27,2019081,Heather Nguyen,Information truth radio condition director possible.,Lance Riley
1973-09-04,Whitney Lowe,3612312251,employee,98,A-541,13:40,2023005,Whitney Lowe,Partner guess both then real.,Spencer Liu
1996-02-02,Jacob Hill,9376915168,sometimes,74,A-359,18:49,2024008,Jacob Hill,Across magazine different arrive part garden cost.,Jordan Erickson
2005-07-06,Bradley Walker,9068048811,budget,80,A-480,21:27,2018079,Bradley Walker,Skin imagine rich similar support there media.,Ruben Oconnor
1987-10-06,Scott Bean,6664324678,trip,53,A-532,13:56,2020020,Scott Bean,None fish common modern.,Becky Graham
1987-04-11,Kenneth Walsh,1501059868,word,34,A-606,02:07,2024080,Kenneth Walsh,Everyone young section find open activity.,Lisa White
2008-06-22,Casey Walker,8172205654,paper,46,A-737,20:38,2024031,Casey Walker,Chance easy indicate record.,Matthew Morris
2003-05-14,Brian Combs DDS,5836051652,establish,99,A-477,03:03,2023016,Brian Combs DDS,Eye role of raise magazine stand.,John Ashley
2011-11-10,Whitney Lowe,3612312251,wear,8,A-361,03:06,2023005,Whitney Lowe,Least give culture author some instead raise.,Roger Fisher
2017-11-24,Jennifer Hines,2743160343,training,35,A-467,17:55,2021050,Jennifer Hines,Long wrong end student sort agent respond.,William Collins
1985-12-02,John Johnson,4509854213,reduce,25,A-471,09:55,2021025,John Johnson,Court everybody two enjoy.,Brian Stone
2023-02-01,Michael Parks,1867481156,yeah,99,A-607,22:13,2018086,Michael Parks,Congress town serious audience.,Adam Archer
1989-03-06,Jason Davis,2195723590,wrong,63,A-49,07:13,2020002,Jason Davis,Course new team current word worker miss base.,Sherry Shields
2012-10-03,Brian Ramirez,1853815569,remain,22,A-196,07:56,2022024,Brian Ramirez,Teacher herself arm mean also budget various.,Martha Collins
2011-01-22,Stacey Miller,4163052932,indicate,64,A-755,17:52,2021092,Stacey Miller,Alone mouth edge drop see.,John Zamora
1993-11-14,Bradley Walker,9068048811,leader,97,A-638,20:12,2018079,Bradley Walker,Answer moment design main ahead war store.,Robert Phelps
2007-11-19,Sylvia Turner,9733698319,summer,82,A-221,01:21,2019076,Sylvia Turner,Century democratic stay chair hold science current current.,Brittany Martin
1999-07-21,Robin Gray,1073485429,possible,51,A-206,18:49,2020033,Robin Gray,Product early yes once.,Nicole Cox
2012-07-16,Sarah Mcbride,9722478566,your,51,A-930,02:54,2021060,Sarah Mcbride,About light ahead watch.,Margaret Smith
2015-02-17,Jason Davis,2195723590,large,38,A-164,21:04,2020002,Jason Davis,Water those anything ability city new section.,James Shelton
1985-04-03,Connor Ellis,4730469442,something,10,A-874,15:02,2023091,Connor Ellis,Well protect ten toward bag film method.,Vanessa Norman
1990-05-18,Jessica Robinson,2743909385,recently,92,A-58,13:25,2020084,Jessica Robinson,Change structure test.,Ronald Joseph
1982-02-23,Scott Bean,6664324678,be,13,A-633,14:06,2020020,Scott Bean,Play consumer whatever ok.,Kelly Ramirez
2008-08-24,Brian Combs DDS,5836051652,explain,66,A-376,23:30,2023016,Brian Combs DDS,Learn color movement whatever order.,Sandra Davis
1973-01-02,Richard Smith,2421313196,control,34,A-711,16:15,2022044,Richard Smith,His population send at.,Wanda Lin
1997-08-31,Heather Nguyen,6127299695,message,71,A-867,09:41,2019081,Heather Nguyen,Billion according American near stand.,Lindsey Parker
2023-03-01,Connie Cisneros,7281111390,official,81,A-850,16:50,2021028,Connie Cisneros,Meeting value show meet.,Brent Anderson
2008-12-29,Daniel Wright,7047803128,head,5,A-253,03:53,2019064,Daniel Wright,Year return new nation budget people.,Kara Johnson
1999-07-17,Robin Gray,1073485429,eight,38,A-404,16:54,2020033,Robin Gray,Newspaper term spend partner issue staff.,Robert Smith
1999-03-28,Rebecca Lin,3718152833,lay,83,A-655,11:12,2022056,Rebecca Lin,Lay item eye through.,James Beck
1995-08-28,Brenda Wagner,5297357394,recent,47,A-746,21:48,2024065,Brenda Wagner,Unit interest since affect.,Brenda Schultz
